id,exercise_name,videoURL,steps,Category,Difficulty,Force,Grips,target,youtubeURL,details,Aka
230,Barbell Sumo Deadlift,"['https://media.musclewiki.com/media/uploads/videos/branded/male-barbell-sumo-deadlift-front.mp4#t=0.1', 'https://media.musclewiki.com/media/uploads/videos/branded/male-barbell-sumo-deadlift-side.mp4#t=0.1']","['Stance width can vary with a sumo DL. Some prefer toes near the plates. Others prefer a more narrow stance to get more drive off the floor.', 'Make sure your arms are inside your legs. The bar should be just over your mid-foot. Flatten your back and push your heels into the floor.', 'Try to extend your knees and hips simultaneously.']",Barbell,Intermediate,,,"{'Primary': ['Glutes'], 'Secondary': ['Quads'], 'Tertiary': ['Lower back']}",https://www.youtube.com/embed/C6aXGfIilEE,"

Barbell Sumo Deadlift: A Comprehensive Guide
Setup

Start by selecting an appropriate weight on the barbell
Position the barbell in front of your feet, making sure it is centered and directly under the bar
Stand with your feet slightly wider than hip-width apart, with your toes pointing outwards
Bend your knees and lower yourself until your shins touch the bar
Grip the bar with your hands, making sure they are positioned just outside your feet
Take a deep breath and tighten your core muscles to prepare for the lift

How to Perform

Lift your chest, straighten your back, and look forward
Begin by driving through your heels and pushing your hips forward
Lift the bar off the ground by extending your hips and knees
Make sure to keep your chest lifted and your back straight throughout the lift
Once the bar reaches knee height, pause briefly before continuing the movement
Lower the bar back to the ground by reversing the movement, bending your hips and knees
Repeat the exercise for the desired number of repetitions

Technique

Keep your feet flat on the ground and maintain your balance throughout the exercise
Avoid rounding your back, as this can cause injury and decrease your lifting efficiency
Keep your core tight and maintain good posture to prevent your lower back from arching
Use your legs and hips, not your arms or back, to lift the bar off the ground
Do not drop the bar, but rather control the descent back to the ground

Things to Avoid

Using too much weight that may compromise your technique and increase your risk of injury
Rounding your back or allowing your hips to drop too low during the lift
Bouncing the bar off the ground, as this can cause strain on your lower back
Lifting with your arms instead of using your legs and hips
Forgetting to warm up properly before starting the exercise

",
231,Burpee,"['https://media.musclewiki.com/media/uploads/videos/branded/male-bodyweight-burpee-front.mp4#t=0.1', 'https://media.musclewiki.com/media/uploads/videos/branded/male-bodyweight-burpee-side.mp4#t=0.1']","['Start standing with your feet hip-width apart. Lower your body into a squat position, placing your hands on the ground in front of you.', 'Quickly jump your feet back into a plank position, keeping your body in a straight line from your head to your toes.', 'Perform a push-up, keeping your core tight and your elbows close to your body.', 'Jump your feet back towards your hands, and then jump up into the air, reaching your arms overhead.', 'Land softly and immediately lower your body back into the squat position to repeat the movement.']",Bodyweight,Intermediate,Push,Overhand,"{'Primary': ['Chest', 'Abdominals'], 'Secondary': ['Quads'], 'Tertiary': ['Glutes']}",,,
232,Plate Squat Hold Reach,"['https://media.musclewiki.com/media/uploads/videos/branded/male-plate-squat-hold-reach-front.mp4#t=0.1', 'https://media.musclewiki.com/media/uploads/videos/branded/male-plate-squat-hold-reach-side.mp4#t=0.1']","['Hold the plate with both hands at chest height.', 'Keeping your core tight and your chest up, squat down as low as you can go while keeping your feet flat on the ground.', 'Hold the squat position and reach the plate forward, keeping your arms straight and your back straight.', 'Return the plate to your chest while you hold the squat position and repeat reaching the plate in front of you']",Plate,Intermediate,,,"{'Primary': ['Triceps', 'Shoulders'], 'Secondary': ['Quads', 'Glutes']}",,,
233,Plate Squat Hold Curl,"['https://media.musclewiki.com/media/uploads/videos/branded/male-plate-squat-hold-curl-front.mp4#t=0.1', 'https://media.musclewiki.com/media/uploads/videos/branded/male-plate-squat-hold-curl-side.mp4#t=0.1']","['Lower into a squat position, keeping the plate at chest height.', 'Slowly curl the plate towards your shoulders, keeping your elbows close to your body.', 'Hold for a moment at the top of the curl before lowering the plate back to chest height.', 'Repeat the curls as you hold the squat position.']",Plate,Intermediate,,,"{'Primary': ['Biceps'], 'Secondary': ['Quads', 'Glutes']}",,,
234,Plate Single Leg Deadlift,"['https://media.musclewiki.com/media/uploads/videos/branded/male-plate-single-leg-deadlift-front.mp4#t=0.1', 'https://media.musclewiki.com/media/uploads/videos/branded/male-plate-single-leg-deadlift-side.mp4#t=0.1']","['Engage your core and straighten your legs to lift the plate off the ground.', 'Stand on one leg, keeping the other leg off the ground, while holding the plate in front of your body.', 'Keep your back straight and maintain a neutral head position while looking straight ahead.', 'Lower the plate back down to the ground while keeping your balance on one leg.']",Plate,Advanced,,,"{'Primary': ['Quads', 'Hamstrings'], 'Secondary': ['Glutes'], 'Tertiary': ['Lower back']}",,,
235,Crescent Moon Pose,"['https://media.musclewiki.com/media/uploads/videos/branded/male-yoga-crescent-moon-pose-front.mp4#t=0.1', 'https://media.musclewiki.com/media/uploads/videos/branded/male-yoga-crescent-moon-pose-side.mp4#t=0.1']","[""Begin in Runner's Lunge pose with your right foot forward."", 'Slowly lift your torso up and bring your arms overhead, palms facing each other.', 'Make sure your right knee is directly above your ankle, and your left leg is straight behind you.', 'Hold for a few breaths before repeating on the other side.']",Yoga,Beginner,Hold,,{'Primary': ['Quads']},,,Añjaneyasana
236,Crescent Moon Pose Quad Stretch,"['https://media.musclewiki.com/media/uploads/videos/branded/male-yoga-crescent-moon-pose-quad-stretch-front.mp4#t=0.1', 'https://media.musclewiki.com/media/uploads/videos/branded/male-yoga-crescent-moon-pose-quad-stretch-side.mp4#t=0.1']","['Begin in Crescent Moon Pose with your right foot forward and a block nearby.', 'Place the block at the highest height under your left hand.', 'Reach your left arm behind you and take hold of your left foot or ankle.', 'Gently pull your foot towards your buttocks while pressing your left hand into the block to deepen the stretch in your left quad. Hold for a few breaths before releasing and repeating on the other side.']",Yoga,Intermediate,Hold,,{'Primary': ['Quads']},,,Añjaneyasana
237,Crescent Moon Pose Quad Stretch With Block,"['https://media.musclewiki.com/media/uploads/videos/branded/male-yoga-crescent-moon-pose-quad-stretch-with-block-front.mp4#t=0.1', 'https://media.musclewiki.com/media/uploads/videos/branded/male-yoga-crescent-moon-pose-quad-stretch-with-block-side.mp4#t=0.1']","['Begin in Crescent Moon Pose with your right foot forward and a block nearby.', 'Place the block at the highest height under your left hand.', 'Reach your left arm behind you and take hold of your left foot or ankle.', 'Gently pull your foot towards your buttocks while pressing your left hand into the block to deepen the stretch in your left quad. Hold for a few breaths before releasing and repeating on the other side.']",Yoga,Beginner,Hold,,{'Primary': ['Quads']},,,Añjaneyasana
238,Lord Of The Dance,"['https://media.musclewiki.com/media/uploads/videos/branded/male-yoga-lord-of-the-dance-front.mp4#t=0.1', 'https://media.musclewiki.com/media/uploads/videos/branded/male-yoga-lord-of-the-dance-side.mp4#t=0.1']","['Begin by standing tall with your feet hip-width apart.', 'Shift your weight onto your left foot and bring your right heel towards your glute.', 'Reach your right arm back and grab onto the inside of your right foot or ankle.', 'Inhale and lift your right foot away from your glute while extending your left arm forward. Hold for 5-10 breaths before switching sides.']",Yoga,Intermediate,Hold,,{'Primary': ['Quads']},,,Natarajasana
239,Monkey Pose,"['https://media.musclewiki.com/media/uploads/videos/branded/male-yoga-monkey-pose-front.mp4#t=0.1', 'https://media.musclewiki.com/media/uploads/videos/branded/male-yoga-monkey-pose-side.mp4#t=0.1']","['Begin in a low lunge with your right foot forward and your left knee on the ground.', 'Slowly slide your left knee back while extending your right leg forward, keeping both legs straight.', 'Lower your body down to the ground, using your hands for support if needed.', 'Hold the pose for a few breaths, then switch sides and repeat.']",Yoga,Advanced,Hold,,"{'Primary': ['Quads'], 'Secondary': ['Hamstrings']}",,,Hanumanasana
240,Monkey Pose With Blocks,"['https://media.musclewiki.com/media/uploads/videos/branded/male-yoga-monkey-pose-with-blocks-front.mp4#t=0.1', 'https://media.musclewiki.com/media/uploads/videos/branded/male-yoga-monkey-pose-with-blocks-side.mp4#t=0.1']","['Begin in tabletop position, with hands and knees on the ground.', 'Place yoga blocks shoulder-width apart under your hands.', 'Shift your hips back towards your heels, while keeping your arms straight.', 'Hold the pose for several deep breaths, feeling a stretch in your shoulders and upper back. Release the pose and return to tabletop position.']",Yoga,Intermediate,Hold,,"{'Primary': ['Quads'], 'Secondary': ['Hamstrings']}",,,Hanumanasana
241,Runners Lunge,"['https://media.musclewiki.com/media/uploads/videos/branded/male-yoga-runners-lunge-front.mp4#t=0.1', 'https://media.musclewiki.com/media/uploads/videos/branded/male-yoga-runners-lunge-side.mp4#t=0.1']","['Begin in Downward Facing Dog pose (Adho Mukha Svanasana).', 'Step your right foot forward between your hands.', 'Place your left knee on the ground behind you and slide it back until you feel a stretch in your left hip flexor.', 'Keep your hands on the ground or lift them to the sky and hold for a few breaths before repeating on the other side.']",Yoga,Beginner,Hold,,{'Primary': ['Quads']},,,Utthita Ashwa Sanchalanasana
242,Chair Pose,"['https://media.musclewiki.com/media/uploads/videos/branded/male-yoga-chair-pose-front.mp4#t=0.1', 'https://media.musclewiki.com/media/uploads/videos/branded/male-yoga-chair-pose-side.mp4#t=0.1']","['Stand straight with your feet hip-width apart and arms at your sides.', 'Inhale and raise your arms straight up over your head.', 'Exhale and bend your knees, lowering your hips as if you were sitting in a chair.', 'Hold the pose for a few breaths, then inhale and stand up straight.']",Yoga,Beginner,Hold,,"{'Primary': ['Quads'], 'Secondary': ['Shoulders']}",,,Utkatasana
243,Ball Headlock Squat,"['https://media.musclewiki.com/media/uploads/videos/branded/male-medicine-ball-headlock-squat-front.mp4#t=0.1', 'https://media.musclewiki.com/media/uploads/videos/branded/male-medicine-ball-headlock-squat-front.mp4#t=0.1', 'https://media.musclewiki.com/media/uploads/videos/branded/male-medicine-ball-headlock-squat-side.mp4#t=0.1']",[],MedicineBall,,,,{},,,
244,Dumbbell Seated Shrug,"['https://media.musclewiki.com/media/uploads/videos/branded/male-dumbbell-seated-shrug-front.mp4#t=0.1', 'https://media.musclewiki.com/media/uploads/videos/branded/male-dumbbell-seated-shrug-side.mp4#t=0.1']","['Sit on a bench with dumbbells in both hands, palms facing your body, back straight.', 'Elevate your shoulders and hold the contracted position at the apex of the motion.', 'Slowly lower your shoulders back to starting position.']",Dumbbells,Beginner,Pull,Neutral,{'Primary': ['Traps']},https://www.youtube.com/embed/sgcOZ3wcWmI,"
How To Perform The Seated ShrugSetupGrab two dumbbells and sit at the edge of either a bench or box. Bring your legs relatively close together, so they are out of the way of the dumbbells.Use the cue, ""superman chest."" Imagine you have the Superman logo on your chest and show it off. This will open your chest and force you to sit tall while pulling your shoulder blades back.Let your arms be in a dead hang position.Performing the Seated ShrugPull your shoulder joint straight up toward the ceiling. Get your shoulders as high as you can. You should feel your traps contract very hard when you have hit an adequate range of motion. From this point, begin to drop your shoulders back down to the starting position.Avoid rolling your shoulders. This is a very common form mistake on shrugs. The upper portion of the traps elevates the scapula, while the mid and lower traps, retract and depress the scapula. However, when you are in a seated or standing position the dumbbells will be pulling downward (because of gravity) so scapular elevation is the only anatomical function being performed against resistance. Therefore, retracting and depressing the scapula on each rep (rolling the shoulders) will not recruit your mid and lower traps. You would need a different exercise for that.Also, pay particular attention to your neck. It is also very common to push one's head forward when performing a shrug. This can put unnecessary stress on your neck and cervical spine. Keep your chin pulled back and your head in a neutral position.
",
245,Smith Machine Standing Shrugs,['https://media.musclewiki.com/media/uploads/videos/branded/male-standing-smith-machine-shrugs-front.mp4#t=0.1'],"['Place the bar on a lower rung so that when gripped your arms are fully extended and your back is straight.', 'Grip at shoulder width, raise the bar with your shoulders and pause at the contracted position.', 'Slowly lower the bar back to starting position.']",Machine,Beginner,Pull,Overhand,{'Primary': ['Traps']},,,
246,Kettlebell Shrug,"['https://media.musclewiki.com/media/uploads/videos/branded/male-kettlebell-shrug-front.mp4#t=0.1', 'https://media.musclewiki.com/media/uploads/videos/branded/male-kettlebell-shrug-side.mp4#t=0.1']","['Standing up straight with feet shoulder width apart.', 'Holding the kettlebell in both hands in front of your pelvis, engage your shoulder blades, as if you are trying to touch them together.', 'Release the shrug and repeat']",Kettlebells,Beginner,,,{'Primary': ['Traps']},,,
247,Kettlebell Upright Row,"['https://media.musclewiki.com/media/uploads/videos/branded/male-kettlebell-upright-row-front.mp4#t=0.1', 'https://media.musclewiki.com/media/uploads/videos/branded/male-kettlebell-upright-row-side.mp4#t=0.1']","['Stand with your feet shoulder width apart holding the kettlebell with both hands in front of your thighs.', 'Bend forward at the hips bringing the kettlebell to the floor while you slightly bend your knees, keeping your back straight.', 'Lift the kettlebell upwards towards your chest and lower - repeat.']",Kettlebells,Beginner,,,{'Primary': ['Traps']},https://www.youtube.com/embed/v7nsz05s9oM,,
248,Kettlebell Silverback Shrug,"['https://media.musclewiki.com/media/uploads/videos/branded/male-kettlebell-silverback-shrug-front.mp4#t=0.1', 'https://media.musclewiki.com/media/uploads/videos/branded/male-kettlebell-silverback-shrug-side.mp4#t=0.1']","['Stand with your feet shoulder width apart holding the kettlebell with both hands in front of your thighs.', 'Bend forward at the hips bringing the kettlebell to the floor while you slightly bend your knees, keeping your back straight.', 'Holding the kettlebell in both hands engage your shoulder blades, as if you are trying to touch them together. Release the shrug.']",Kettlebells,Intermediate,,,"{'Primary': ['Traps'], 'Secondary': ['Mid back']}",,,
249,Traps Stretch Variation Three,"['https://media.musclewiki.com/media/uploads/videos/branded/male-traps-stretch-variation-3-front.mp4#t=0.1', 'https://media.musclewiki.com/media/uploads/videos/branded/male-traps-stretch-variation-3-side.mp4#t=0.1']","['Stand upright with your feet shoulder width apart.', 'Nod your head forward, bringing your chin to your chest.', 'You will feel the stretch across your neck.']",Stretches,Beginner,,None,{'Primary': ['Traps']},,,
250,Traps Stretch Variation Two,"['https://media.musclewiki.com/media/uploads/videos/branded/male-traps-stretch-variation-2-front.mp4#t=0.1', 'https://media.musclewiki.com/media/uploads/videos/branded/male-traps-stretch-variation-2-side.mp4#t=0.1']","['Keeping your chest facing forward, turn your head 90 degrees to the left. Then return to centre point.', 'Stand upright with your feet shoulder width apart.', 'Repeat, turning your head in the other direction.']",Stretches,Beginner,,None,{'Primary': ['Traps']},,,
251,Traps Stretch Variation One,"['https://media.musclewiki.com/media/uploads/videos/branded/male-traps-stretch-variation-1-front.mp4#t=0.1', 'https://media.musclewiki.com/media/uploads/videos/branded/male-traps-stretch-variation-1-side.mp4#t=0.1']","['Stand upright with your feet shoulder width apart.', 'Place your left hand on your head and gently pull your head down towards your left shoulder. Then return to centre point.', 'Repeat, using your right hand pulling towards your right shoulder.']",Stretches,Beginner,,None,{'Primary': ['Traps']},,,
252,Elevated Pike Shoulder Shrug,"['https://media.musclewiki.com/media/uploads/videos/branded/male-bodyweight-elevated-pike-shrug-front.mp4#t=0.1', 'https://media.musclewiki.com/media/uploads/videos/branded/male-bodyweight-elevated-pike-shrug-side.mp4#t=0.1']","['Use a bench or an object like a chair to elevate your feet.', 'Slowly lower your body (scapula) while keeping your elbows locked (this is key)', 'Slowly raise your body back to the start position.']",Bodyweight,Beginner,,,"{'Primary': ['Traps', 'Shoulders']}",,,
253,Barbell Silverback Shrug,"['https://media.musclewiki.com/media/uploads/videos/branded/male-barbell-silverback-shrug-front.mp4#t=0.1', 'https://media.musclewiki.com/media/uploads/videos/branded/male-barbell-silverback-shrug-side.mp4#t=0.1']","['Stand with your feet shoulder width apart holding the Barbell with both hands in front just past shoulder width.', 'Bend forward at the hips with a slight bend in your knees, keeping your back straight.', 'Engage your shoulder blades, as if you are trying to touch them together.', 'Release the shrug.']",Barbell,Intermediate,Pull,Overhand Mixed,{'Primary': ['Traps']},,"

Barbell Silverback Shrug: A Comprehensive Guide
Setup

Start by selecting a barbell that is the appropriate weight for your fitness level and strength
Load the barbell with weight plates, making sure to secure them onto the barbell with collars
Stand in front of the barbell, with your feet shoulder-width apart and your knees slightly bent
Grasp the barbell with an overhand grip, making sure that your hands are slightly wider than shoulder-width apart
Position the barbell in front of your thighs, with your arms extended and your shoulders relaxed

How to Perform

Inhale and lift the barbell up towards your chest, keeping your arms extended and your shoulders relaxed
Exhale and shrug your shoulders upwards, towards your ears
Pause for a moment at the top of the movement, holding the barbell and your shoulders in position
Inhale and lower the barbell back down to the starting position, keeping your arms extended and your shoulders relaxed
Repeat for the desired number of repetitions

Technique

Make sure to keep your focus on shrugging your shoulders upwards, rather than lifting the barbell
Avoid using your arms to pull the barbell upwards, as this can place unnecessary stress on your back and neck
Keep your chin tucked in, to maintain good posture and prevent straining your neck
Make sure to keep your shoulders relaxed and your arms extended throughout the entire movement

Things to Avoid

Avoid rounding your back or hunching your shoulders, as this can put unnecessary strain on your back and neck
Avoid twisting or rotating your arms, as this can cause the barbell to become unevenly balanced and increase your risk of injury
Avoid using too much weight, as this can cause you to lose proper form and increase your risk of injury

",
254,Cable 30 Degree Shrug,"['https://media.musclewiki.com/media/uploads/videos/branded/male-cable-shrug-front.mp4#t=0.1', 'https://media.musclewiki.com/media/uploads/videos/branded/male-cable-shrug-side.mp4#t=0.1']","['Use a handle attachment on both sides of crossover. With cable attachment set all the way to the bottom.', 'Grab both handles and make sure you are centered in the machine. Let your arms hang freely.', 'Pull your shoulder blades up and in towards your ears. Let your shoulder blades depress back to the starting position.']",Cables,Beginner,Pull,Neutral,{'Primary': ['Traps']},,,
255,Band Shrug,"['https://media.musclewiki.com/media/uploads/videos/branded/male-band-shrug-front.mp4#t=0.1', 'https://media.musclewiki.com/media/uploads/videos/branded/male-band-shrug-side.mp4#t=0.1']","['Place the band under your feet. Stand upright.', 'Elevate your shoulder blades and then depress back to the starting position.']",Band,Beginner,,,{'Primary': ['Traps']},,,
256,Dumbbell Shrug,"['https://media.musclewiki.com/media/uploads/videos/branded/male-dumbbell-shrug-front_8g0TOxX.mp4#t=0.1', 'https://media.musclewiki.com/media/uploads/videos/branded/male-dumbbell-shrug-side_vS2pKIC.mp4#t=0.1']",['Stand tall with two dumbbells. Pull your shoulder blades up. Give a one second squeeze at the top.'],Dumbbells,Beginner,Pull,Neutral,{'Primary': ['Traps']},,"
How To Perform The Standing Dumbbell ShrugSetupGrab two dumbbells and stand tall with a narrow foot stance. Poke your chest out and pull your shoulder blades back. The dumbbells should be on the side of your legs. Performing Pull your shoulder joint straight up toward the ceiling. Get your shoulders as high as you can. You should feel your traps contract very hard when you have hit an adequate range of motion. From this point, begin to drop your shoulders back down to the starting position.Avoid rolling your shoulders. This is a very common form mistake on shrugs. The upper portion of the traps elevates the scapula, while the mid and lower traps, retract and depress the scapula. However, when you are in a seated or standing position the dumbbells will be pulling downward (because of gravity) so scapular elevation is the only anatomical function being performed against resistance. Therefore, retracting and depressing the scapula on each rep (rolling the shoulders) will not recruit your mid and lower traps. You would need a different exercise for that.Also, pay particular attention to your neck. It is also very common to push one's head forward when performing a shrug. This can put unnecessary stress on your neck and cervical spine. Keep your chin pulled back and your head in a neutral position.
",
257,Barbell Shrug,"['https://media.musclewiki.com/media/uploads/videos/branded/male-barbell-shrug-front.mp4#t=0.1', 'https://media.musclewiki.com/media/uploads/videos/branded/male-barbell-shrug-side.mp4#t=0.1']","['Start by standing with your feet about hip-width apart, with a barbell in front of you.', 'Bend down and grab the barbell with an overhand grip, your hands slightly wider than shoulder-width apart. Keep your back straight and your shoulders down as you grip the bar.', 'Stand up straight, lifting the barbell off the ground and pulling it toward your hips. Keep your elbows close to your body and your shoulders down as you do this.', 'Once the barbell is at your hips, raise your shoulders as high as you can, holding the position for a moment.']",Barbell,Beginner,Pull,Overhand,{'Primary': ['Traps']},,,
258,Dumbbell Laying 30 Degree Shrug,"['https://media.musclewiki.com/media/uploads/videos/branded/male-dumbbell-laying-30-degree-shrug-front.mp4#t=0.1', 'https://media.musclewiki.com/media/uploads/videos/branded/male-dumbbell-laying-30-degree-shrug-side.mp4#t=0.1']","['Lay sideways on a bench letting your arm hang freely.', 'Pull your shoulder blade and joint toward the ceiling.']",Dumbbells,Intermediate,Pull,Overhand Neutral,{'Primary': ['Traps']},,,
259,Plate Overhead Carry,"['https://media.musclewiki.com/media/uploads/videos/branded/male-plate-overhead-carry-front.mp4#t=0.1', 'https://media.musclewiki.com/media/uploads/videos/branded/male-plate-overhead-carry-side.mp4#t=0.1']","['Start by standing upright with your feet shoulder-width apart. Hold a single weight plate overhead with both hands, keeping your arms extended straight above your head.', 'Begin walking forward, taking slow and steady steps while maintaining a straight line. Your focus should be on maintaining balance and control of the weight plate overhead.', 'As you walk, continue to keep your arms extended and the weight plate overhead. Try to maintain good posture and avoid leaning forward or backward, as this could result in losing control of the weight plate.', 'Continue walking for a set distance or for a certain amount of time, keeping your focus on proper form and technique. When finished, return to the starting position and repeat as desired.']",Plate,Beginner,Hold,Neutral,"{'Primary': ['Traps', 'Abdominals'], 'Secondary': ['Shoulders']}",,,
260,Plate Overhead Shrug,"['https://media.musclewiki.com/media/uploads/videos/branded/male-plate-overhead-shrug-front.mp4#t=0.1', 'https://media.musclewiki.com/media/uploads/videos/branded/male-plate-overhead-shrug-side.mp4#t=0.1']","['Stand tall with a weight plate overhead.', 'Elevated and depress your scapula.', 'Avoid leaning forward or backwards to keep pressure off of your lumbar spine.']",Plate,Advanced,Push,Neutral,{'Primary': ['Traps']},,,
