id,exercise_name,videoURL,steps,Category,Difficulty,Force,Grips,target,youtubeURL,details,Aka
710,Half Lotus,"['https://media.musclewiki.com/media/uploads/videos/branded/male-yoga-half-lotus-front.mp4#t=0.1', 'https://media.musclewiki.com/media/uploads/videos/branded/male-yoga-half-lotus-side.mp4#t=0.1']","['Sit on a yoga mat with legs straight in front of you.', 'Bend the right knee and place the right foot on top of the left thigh. Allow the right knee to fall towards the floor.', 'Bring the left foot onto the right thigh. Keep the spine straight and rest hands on the knees.', 'Hold for several breaths and then release.']",Yoga,Beginner,Hold,,{'Primary': ['Glutes']},,,Padmasana
711,Barbell Behind The Back Wrist Curl,"['https://media.musclewiki.com/media/uploads/videos/branded/male-barbell-behind-the-back-wrist-curl-front.mp4#t=0.1', 'https://media.musclewiki.com/media/uploads/videos/branded/male-barbell-behind-the-back-wrist-curl-side.mp4#t=0.1']","['Stand straight and hold the barbell behind you using a pronated grip with your hands and feet shoulder-width apart.', 'Slowly curl your wrists in a semi-circular motion upwards.', 'Hold the barbell at the apex of the motion and then slowly lower the barbell back down to starting position.']",Barbell,Intermediate,,,{'Primary': ['Forearms']},,"

Barbell Behind The Back Wrist Curl: A Comprehensive Guide
Setup

Choose a barbell that is appropriate for your current level of strength
Stand with your feet shoulder-width apart and your knees slightly bent
Grasp the barbell with both hands and hold it behind your back
Make sure your elbows are straight and your palms are facing downwards

How to Perform

Keeping your elbows straight, slowly lift the barbell towards your wrist
Exhale as you lift the weight
Pause for a moment at the top of the movement
Slowly lower the barbell back to the starting position, inhaling as you do so
Repeat for the desired number of repetitions

Technique

Make sure to keep your elbows straight throughout the entire movement
Do not allow your shoulders to shrug during the exercise
Keep your wrists in a neutral position, not letting them rotate during the movement
Focus on using only your wrist muscles to lift the weight, not your arms or shoulders

Things to Avoid

Using a weight that is too heavy for your current strength level
Allowing your elbows to bend during the movement
Shrugging your shoulders during the exercise
Letting your wrists rotate during the movement
Rushing through the exercise, instead focus on controlled movements

",
712,Dumbbell Wrist Curl,"['https://media.musclewiki.com/media/uploads/videos/branded/male-dumbbell-wrist-curl-front.mp4#t=0.1', 'https://media.musclewiki.com/media/uploads/videos/branded/male-dumbbell-wrist-curl-side.mp4#t=0.1']","['Grip the dumbbell with your palm facing upwards with your forearm rested against the bench.', 'Slowly curl your wrist upwards in a semicircular motion.', 'Return to starting position and repeat.']",Dumbbells,Beginner,Pull,Underhand,{'Primary': ['Forearms']},https://www.youtube.com/embed/S-ynXc4M-mY,"
How To Perform The Dumbbell Wrist CurlSetupYou will need a box or a bench. You can either take a seated position (like in our demo video), or a kneeling position. In the seated position, put your feet shoulder width, and drape your forearms over your knees. In a kneeling position, drape your forearms over the edge of the box, or a bench. Your forearms should be far enough off the box or bench that you can fully flex your wrist at the bottom of the range of motion.PerformingLet the dumbbells fully extend your wrists before initiating the concentric. Flex your wrists and point your fists up towards the ceiling as high as you possibly can. You should feel the forearm muscles on the bottom of your arm contract really hard. Make sure to focus on the range of motion with this exercise. It can be very easy to begin doing partial range of motion reps on this exercise. Like any other exercise, when you can no longer perform the adequate range of motion end the set 
",
713,Barbell Wrist Curl,"['https://media.musclewiki.com/media/uploads/videos/branded/male-barbell-wrist-curl-front_j9uRhfT.mp4#t=0.1', 'https://media.musclewiki.com/media/uploads/videos/branded/male-barbell-wrist-curl-side_v5A0kZk.mp4#t=0.1']","['Grab a straight bar with a supinated (underhand) grip.', 'Kneel down next to a flat bench and place your forearms on the bench with your wrists just off the bench.', 'Let the barbell pull down on your wrists until they are extended.', 'Curl the barbell until your wrists are fully flexed.', 'Lower in a controlled manner and repeat.']",Barbell,Beginner,,,{'Primary': ['Forearms']},,"

Barbell Wrist Curl: A Comprehensive Guide
Setup

Choose a barbell with a moderate weight
Kneel down on a flat bench and place your forearms on the bench with your palms facing up
Hold the barbell with a pronated grip (palms facing down)
Keep your elbows close to your sides and make sure your wrists are off the edge of the bench

How to Perform

Begin by lifting the barbell with your wrist flexors until your hands are facing upwards
Slowly lower the barbell back down to the starting position
Repeat the movement for the desired number of repetitions
Make sure to maintain control of the barbell throughout the movement

Technique

Keep your wrists stable and avoid any unnecessary movements
Make sure to focus the contraction in your wrist flexors
Use a smooth, controlled motion throughout the exercise

Things to Avoid

Avoid using too heavy of a weight and compromising your form
Avoid allowing the barbell to rest on your fingers
Avoid using too much momentum and relying on swinging the weight

",
714,Kettlebell Farmers Carry,"['https://media.musclewiki.com/media/uploads/videos/branded/male-kettlebell-farmers-carry-front.mp4#t=0.1', 'https://media.musclewiki.com/media/uploads/videos/branded/male-kettlebell-farmers-carry-side.mp4#t=0.1']","['Standing straight with a kettlebell in one hand, lift the knee of one leg off the floor to knee height.', 'Bring the leg back to standing and repeat with the other leg, keeping the kettlebell on the same side.', 'Repeat.']",Kettlebells,Beginner,Pull,Neutral,{'Primary': ['Forearms']},,,
715,Kettlebell Wrist Extension,"['https://media.musclewiki.com/media/uploads/videos/branded/male-kettlebell-wrist-extension-front.mp4#t=0.1', 'https://media.musclewiki.com/media/uploads/videos/branded/male-kettlebell-wrist-extension-side.mp4#t=0.1']","['Stand up straight with a kettlebell in both hands in front of your pelvis, with your forearms facing inwards.', 'Flex your wrist upwards until wrists are fully extended.', 'Lower to the starting position and repeat.']",Kettlebells,Beginner,,,{'Primary': ['Forearms']},,,
716,Kettlebell Wrist Curl,"['https://media.musclewiki.com/media/uploads/videos/branded/male-kettlebell-wrist-curl-front.mp4#t=0.1', 'https://media.musclewiki.com/media/uploads/videos/branded/male-kettlebell-wrist-curl-side.mp4#t=0.1']","['Stand up straight with a kettlebell in both hands in front of your pelvis, with your forearms facing outwards.', 'Flex your wrist towards your body until the kettlebell is level with your stomach.', 'Lower to the starting position and repeat.']",Kettlebells,Beginner,,,{'Primary': ['Forearms']},,,
717,Forearms Stretch Variation Four,"['https://media.musclewiki.com/media/uploads/videos/branded/male-forearms-stretch-variation-4-front.mp4#t=0.1', 'https://media.musclewiki.com/media/uploads/videos/branded/male-forearms-stretch-variation-4-side.mp4#t=0.1']","['Raise your arm to shoulder height at 90 degrees to your body.', 'Press lightly on your hand and push towards you.', 'Rotate the arm across your body.', 'Switch sides and repeat.']",Stretches,Beginner,,None,{'Primary': ['Forearms']},,,
718,Forearms Stretch Variation Three,"['https://media.musclewiki.com/media/uploads/videos/branded/male-forearms-stretch-variation-3-front.mp4#t=0.1', 'https://media.musclewiki.com/media/uploads/videos/branded/male-forearms-stretch-variation-3-side.mp4#t=0.1']","['Place your hands together.', 'Rotate your arms and hands 180 degrees.', 'Hold at the peak of the stretch.', 'Return to starting position.']",Stretches,Beginner,,None,{'Primary': ['Forearms']},,,
719,Forearms Stretch Variation Two,"['https://media.musclewiki.com/media/uploads/videos/branded/male-forearms-stretch-variation-2-front.mp4#t=0.1', 'https://media.musclewiki.com/media/uploads/videos/branded/male-forearms-stretch-variation-2-side.mp4#t=0.1']","['Place your hand against a wall, palms facing upward, with finger tips touching.', 'Hold at the peak of the stretch.', 'Return to starting position.', 'Slowly lean into your palm.']",Stretches,Beginner,,None,{'Primary': ['Forearms']},,,
720,Forearms Stretch Variation One,"['https://media.musclewiki.com/media/uploads/videos/branded/male-forearms-stretch-variation-1-front.mp4#t=0.1', 'https://media.musclewiki.com/media/uploads/videos/branded/male-forearms-stretch-variation-1-side.mp4#t=0.1']","['Place your palm flush against the wall.', 'Take one step forward and straighten your arm slowly to extend your bicep.', 'Hold at the peak of the stretch.', 'Return to starting position.']",Stretches,Beginner,,None,{'Primary': ['Forearms']},,,
721,Cable Wrist Curl,"['https://media.musclewiki.com/media/uploads/videos/branded/male-cable-wrist-curl-side.mp4#t=0.1', 'https://media.musclewiki.com/media/uploads/videos/branded/male-cable-wrist-curl-front.mp4#t=0.1']","['Use a handle attachment. The cable should be set all the way to the bottom of the machine.', 'Face away from the cable machine. Stagger your stance so you have a better base of support.', 'Start with your elbow at a 90° angle with your palm facing up. Flex and extend at the wrist.']",Cables,Intermediate,,Underhand,{'Primary': ['Forearms']},,,
722,Cable Wrist Extension,"['https://media.musclewiki.com/media/uploads/videos/branded/male-cable-wrist-curl-front.mp4#t=0.1', 'https://media.musclewiki.com/media/uploads/videos/branded/male-cable-wrist-curl-side.mp4#t=0.1']","['Use a handle attachment. The cable should be set all the way to the bottom of the machine.', 'Face away from the cable machine. Stagger your stance so you have a better base of support.', 'Start with your elbow at a 90 degree angle with your palm facing down. Flex and extend at the wrist.']",Cables,Advanced,,Overhand,{'Primary': ['Forearms']},,,
723,Dumbbell Wrist Extension,"['https://media.musclewiki.com/media/uploads/videos/branded/male-dumbbell-wrist-extension-front.mp4#t=0.1', 'https://media.musclewiki.com/media/uploads/videos/branded/male-dumbbell-wrist-extension-side.mp4#t=0.1']","['Grab two dumbbells with an overhand grip and lay your forearms across your knees.', 'Let your wrists flex fully, then extend your wrists.']",Dumbbells,Beginner,Pull,Overhand,{'Primary': ['Forearms']},https://www.youtube.com/embed/lyMpCIUE6ms,"
Dumbbell Wrist Extension Detailed How To:SetupYou will need a box or a bench. You can either take a seated position (like in our demo video), or a kneeling position. In the seated position, put your feet shoulder width, and drape your forearms over your knees. In a kneeling position, drape your forearms over the edge of the box, or a bench. Your forearms should be far enough off the box or bench that you can fully flex your wrist at the bottom of the range of motion.PerformingLet the dumbbells fully flex your wrists before initiating the concentric. Extend your wrists and point your fists up towards the ceiling as high as you possibly can. You should feel the forearm muscles on the top of your arm contract really hard. Make sure to focus on the range of motion with this exercise. It can be very easy to begin doing partial range of motion reps on this exercise. Like any other exercise, when you can no longer perform the adequate range of motion end the set
",
724,Plate Pinch Grip Side Bend,"['https://media.musclewiki.com/media/uploads/videos/branded/male-plate-pinch-grip-side-bend-front.mp4#t=0.1', 'https://media.musclewiki.com/media/uploads/videos/branded/male-plate-pinch-grip-side-bend-side.mp4#t=0.1']","['Stand straight with the plate held at your side', 'Keep your hips and shoulders facing forward, bend to one side slowly', 'Return to the upright position.', 'Switch hands and repeat']",Plate,Beginner,,Pinch Grip,"{'Primary': ['Forearms'], 'Secondary': ['Obliques']}",,,
725,Plate Pinch Grip Farmer's Carry,"['https://media.musclewiki.com/media/uploads/videos/branded/male-plate-pinch-grip-farmers-carry-front.mp4#t=0.1', 'https://media.musclewiki.com/media/uploads/videos/branded/male-plate-pinch-grip-farmers-carry-side.mp4#t=0.1']","['Stand tall holding two plates in each hand with a pinch grip.', 'Walk for the desired distance or time.']",Plate,Intermediate,Hold,Pinch Grip,{'Primary': ['Forearms']},,,
726,Plate Pinch Grip Deadlift,"['https://media.musclewiki.com/media/uploads/videos/branded/male-plate-pinch-grip-deadlift-front.mp4#t=0.1', 'https://media.musclewiki.com/media/uploads/videos/branded/male-plate-pinch-grip-deadlift-side.mp4#t=0.1']","['Stand facing the plate with your feet shoulder-width apart and the plate positioned between your feet.', 'Bend down and grasp the plate from the top edges with both hands, making sure your thumbs and fingers are evenly spaced.', 'Keep your back straight, chest up and core engaged, and stand up with the plate, keeping it close to your body.', 'Lower the plate back down to the ground, keeping control and maintaining good posture.']",Plate,,,Pinch Grip,"{'Primary': ['Lats', 'Forearms'], 'Secondary': ['Hamstrings', 'Glutes'], 'Tertiary': ['Lower back']}",,,
727,Plate Pinch Grip Row,"['https://media.musclewiki.com/media/uploads/videos/branded/male-plate-pinch-grip-row-front.mp4#t=0.1', 'https://media.musclewiki.com/media/uploads/videos/branded/male-plate-pinch-grip-row-side.mp4#t=0.1']","['Make sure to keep your elbow close to your body and your core engaged throughout the movement.', 'Bend forward at your hips while maintaining a flat back.', 'Pull the plate toward your upper abdomen.', 'Lower the weight in a controlled manner and repeat.']",Plate,Intermediate,Pull,Pinch Grip,"{'Primary': ['Forearms'], 'Secondary': ['Lats'], 'Tertiary': ['Biceps']}",,,
728,Inverted Row,"['https://media.musclewiki.com/media/uploads/videos/branded/male-bodyweight-reverse-row-front.mp4#t=0.1', 'https://media.musclewiki.com/media/uploads/videos/branded/male-bodyweight-reverse-row-side.mp4#t=0.1']","['Lay underneath a fixed horizontal bar and grab the bar with a wide overhand grip.', 'Pull your body straight up to the bar.', 'Return to the starting position, your arms fully extended. Repeat.']",Bodyweight,Beginner,Pull,Overhand Underhand,"{'Primary': ['Lats', 'Mid back'], 'Secondary': ['Biceps'], 'Tertiary': ['Forearms']}",,,
729,Chin Ups,"['https://media.musclewiki.com/media/uploads/videos/branded/male-bodyweight-chinup-front.mp4#t=0.1', 'https://media.musclewiki.com/media/uploads/videos/branded/male-bodyweight-chinup-side.mp4#t=0.1']","['Grab the bar shoulder width apart with a supinated grip (palms facing you)', 'With your body hanging and arms fully extended, pull yourself up until your chin is past the bar.', 'Slowly return to starting position. Repeat.']",Bodyweight,Intermediate,Pull,Underhand,"{'Primary': ['Lats'], 'Secondary': ['Biceps'], 'Tertiary': ['Forearms']}",https://www.youtube.com/embed/y6x0AIhgjsM,"
How To Perform The Chin UpSetupGrab the Chin Up bar with an underhand grip. Make sure the bars are set very deeply in your hand. Your palms should be making contact with the bar. Next, if you are using a bench or box to reach the Chin Up bars, step off of the step, and hold for a second, in a dead hang position. If you begin initiating the reps before the dead hang, you might swing too much to perform the exercise strictly. If you can reach the bars without having to stand on anything, take your grip and then pull your feet slightly off the floor. Still hold for a second to prevent any swinging from happening.Pull your shoulder blades down. This will engage your mid and lower traps and force your lats to do most of the work. Also, before beginning the first rep, make sure your elbows are extended.Lower bodyAngle your legs forward slightly, push your hips back, and point your toes. This will force you to flex your abdominals and keep you more stable throughout the rep. (This will massively help you keep the reps strict).PerformingOnce you are in the proper position, begin to pull. Imagine trying to pull your elbows straight down to your sides.Get your chin over the bar before beginning the eccentric portion of the rap. Your elbows should fully extend at the bottom of each rep.Progressing The Chin UpDecide on a rep range. For example, 6 to 10. Once you are able to perform 10 reps with strict form, then it is time to progress. Do not be shy or hesitant to start adding weight early on. Even if it is only 5 pounds. Progress is progress! From there, progress like you would any other exercise. Once you hit the top end of the rep range, add some more weight.The best way to get better at doing Chin Ups is to do Chin Ups. But if you can't do them in the first place, then what should you do? Try the Neutral Grip Chin Up. It’s an easier variation because the lats are in their strongest position.Shorten the range of motion, and try to get a longer range of motion overtime. if you can only do half a Chin Up, (meaning you can get your elbows to roughly 90°) don't be ashamed to do those half reps. Set a rep range like with anything else. We will use 5 to 8 reps for this example. Once you are able to hit 8 of the half reps, try to go an extra 2 to 3 inches higher on each rep. You won't be able to do 8 when you advance the range of motion. So Build your way back up to 8. It helps massively if you can do this in front of a mirror to keep a very close eye on your range of motion. Before long you'll be able to perform full reps.
",
730,Cable Reverse Curl,"['https://media.musclewiki.com/media/uploads/videos/branded/male-cable-reverse-curl-front.mp4#t=0.1', 'https://media.musclewiki.com/media/uploads/videos/branded/male-cable-reverse-curl-side.mp4#t=0.1']","['Use a handle attachment. The cable should be set all the way to the bottom of the machine.', 'Face away from the cable machine. Stagger your stance so you have a better base of support.', 'Face your palm downwards. Flex at the elbow and extend.']",Cables,Intermediate,,,"{'Primary': ['Biceps'], 'Secondary': ['Forearms']}",,,
731,Band Bayesian Hammer Curl,"['https://media.musclewiki.com/media/uploads/videos/branded/male-band-hammer-curl-front.mp4#t=0.1', 'https://media.musclewiki.com/media/uploads/videos/branded/male-band-hammer-curl-side.mp4#t=0.1']","['Attach band to a low anchor point. Use a neutral grip.', 'Flex your elbow until you feel your biceps contract. Then fully extend elbows.']",Band,Intermediate,,,"{'Primary': ['Biceps', 'Forearms']}",https://www.youtube.com/embed/tvRlfjjH5NA,,
732,Band Bayesian Reverse Curl,"['https://media.musclewiki.com/media/uploads/videos/branded/male-band-reverse-curl-front.mp4#t=0.1', 'https://media.musclewiki.com/media/uploads/videos/branded/male-band-reverse-curl-side.mp4#t=0.1']","['Attach band to a low anchor point. . Point your palms toward your thighs.', 'Flex your elbow until you feel your biceps contract. Then fully extend elbows.']",Band,Intermediate,,,"{'Primary': ['Biceps'], 'Secondary': ['Forearms']}",,,
733,Dumbbell Reverse Curl,"['https://media.musclewiki.com/media/uploads/videos/branded/male-dumbbell-reverse-curl-front.mp4#t=0.1', 'https://media.musclewiki.com/media/uploads/videos/branded/male-dumbbell-reverse-curl-side.mp4#t=0.1']","[""Grab the dumbbells with a pronated (overhand) grip. You can do this exercise thumbless if it's more comfortable on your wrists."", 'Flex at the elbows until your biceps touch your forearms. Try not to let your elbows flair outward.']",Dumbbells,Intermediate,Pull,Overhand,"{'Primary': ['Biceps'], 'Secondary': ['Forearms']}",,,
734,Dumbbell Row Unilateral,"['https://media.musclewiki.com/media/uploads/videos/branded/male-dumbbell-row-unilateral-front.mp4#t=0.1', 'https://media.musclewiki.com/media/uploads/videos/branded/male-dumbbell-row-unilateral-side.mp4#t=0.1']","['Brace your off arm against something stable (bench, box). Stagger your stance so your leg on the side of your working arm is back.', 'Try to get your torso to parallel with the ground. That will extend your range of motion.', ""Let your arm hang freely and then pull your elbow back. Imagine you've got a tennis ball in your armpit and squeeze it each rep.""]",Dumbbells,Beginner,Pull,Neutral,"{'Primary': ['Lats', 'Mid back'], 'Secondary': ['Biceps'], 'Tertiary': ['Forearms']}",https://www.youtube.com/embed/r4-3p0KgEA8,,
735,Barbell Reverse Curl,"['https://media.musclewiki.com/media/uploads/videos/branded/male-barbell-reverse-curl-front.mp4#t=0.1', 'https://media.musclewiki.com/media/uploads/videos/branded/male-barbell-reverse-curl-side.mp4#t=0.1']","[""Take a double overhand grip that's about shoulder width. Flex your elbows while keeping your elbows tucked in. Try not to let them flare out."", 'Curl until your forearm presses into your bicep. Then fully extend your elbows at the bottom of each rep.']",Barbell,Advanced,Pull,Overhand,"{'Primary': ['Biceps'], 'Secondary': ['Forearms']}",,"

Barbell Reverse Curl: A Comprehensive Guide
Setup

Select a barbell with the appropriate weight for your strength level
Stand with your feet shoulder-width apart and grip the barbell with a shoulder-width overhand grip
Keep your arms straight and the barbell hanging at arm's length in front of your thighs

How to Perform

Breathe in and tighten your core
Curl the barbell upwards towards your chest, keeping your upper arms stationary and your elbows tucked in close to your torso
Hold the contraction at the top for a count of one
Lower the barbell back down to the starting position with control, inhaling as you do so
Repeat the movement for the desired number of reps

Technique

Keep your movements smooth and controlled throughout the exercise
Avoid using momentum to swing the barbell up and down
Keep your head and neck in a neutral position, looking straight ahead and avoiding any unnecessary neck strain
Engage your shoulder blades and keep your shoulders down and away from your ears

Things to Avoid

Using a weight that is too heavy and sacrificing form
Arching your back or swaying excessively
Locking out your elbows at the top of the movement
Allowing your elbows to flare out to the sides

",
736,Barbell Landmine Row,"['https://media.musclewiki.com/media/uploads/videos/branded/male-barbell-landmine-row-front.mp4#t=0.1', 'https://media.musclewiki.com/media/uploads/videos/branded/male-barbell-landmine-row-side.mp4#t=0.1']","['Position a barbell in a landmine or corner of a room and stand facing it with your feet shoulder-width apart.', 'Grasp the end of the barbell with a neutral grip, keeping your arms straight and your shoulders relaxed.', 'Bend at the hips and knees to lower your torso until it is almost parallel to the ground.', 'Pull the barbell towards your chest, squeezing your shoulder blades together as you row the weight up.']",Barbell,Intermediate,Pull,Overhand,"{'Primary': ['Lats', 'Mid back'], 'Secondary': ['Biceps'], 'Tertiary': ['Forearms']}",,,
737,Barbell Long Landmine Row,"['https://media.musclewiki.com/media/uploads/videos/branded/male-barbell-long-landmine-row-front.mp4#t=0.1', 'https://media.musclewiki.com/media/uploads/videos/branded/male-barbell-long-landmine-row-side.mp4#t=0.1']","['Position a barbell in a landmine or corner of a room and stand facing it with your feet shoulder-width apart.', 'Grasp the end of the barbell with an overhand grip, keeping your arms straight and your shoulders relaxed.', 'Bend at the hips and knees to lower your torso until it is almost parallel to the ground.', 'Pull the barbell towards your chest, squeezing your shoulder blades together as you row the weight up.']",Barbell,Advanced,Pull,Neutral,"{'Primary': ['Lats'], 'Secondary': ['Biceps'], 'Tertiary': ['Forearms']}",,,
738,Barbell Meadows Row,"['https://media.musclewiki.com/media/uploads/videos/branded/male-barbell-meadows-row-side.mp4#t=0.1', 'https://media.musclewiki.com/media/uploads/videos/branded/male-barbell-meadows-row-front.mp4#t=0.1']","['Position a barbell in a landmine or corner of a room and stand facing sideways with a staggered stance and your feet shoulder-width apart.', 'Grasp the end of the barbell with an overhand grip, keeping your arms straight and your shoulders relaxed.', 'Bend at the hips and knees to lower your torso until it is almost parallel to the ground.', 'Pull the barbell towards your chest, squeezing your shoulder blades together as you row the weight up.', '*Named after the late John Meadows']",Barbell,Intermediate,Pull,Overhand,"{'Primary': ['Lats'], 'Secondary': ['Biceps'], 'Tertiary': ['Forearms']}",,,
739,Barbell Pronated Row,"['https://media.musclewiki.com/media/uploads/videos/branded/male-barbell-pronated-row-front.mp4#t=0.1', 'https://media.musclewiki.com/media/uploads/videos/branded/male-barbell-pronated-row-side.mp4#t=0.1']","['Grab the barbell with an overhand grip. Hinge forward while keeping your back flat until your torso is about parallel with the ground.', 'Let your arms hang freely.', 'Pull the bar to your torso while tucking your elbows in slightly.', 'Extend your elbows fully before initiating the next rep.']",Barbell,Beginner,Pull,Overhand,"{'Primary': ['Lats'], 'Secondary': ['Biceps'], 'Tertiary': ['Forearms']}",,,
