id,exercise_name,videoURL,steps,Category,Difficulty,Force,Grips,target,youtubeURL,details,Aka
0,Barbell Curl,"['https://media.musclewiki.com/media/uploads/videos/branded/male-barbell-curl-front.mp4#t=0.1', 'https://media.musclewiki.com/media/uploads/videos/branded/male-barbell-curl-side.mp4#t=0.1']","['While holding the upper arms stationary, curl the weights forward while contracting the biceps as you breathe out.', 'Continue the movement until your biceps are fully contracted and the bar is at shoulder level.', 'Hold the contracted position for a second and squeeze the biceps hard.', 'Slowly bring the weight back down to the starting position.']",Barbell,Beginner,Pull,Underhand,{'Primary': ['Biceps']},https://www.youtube.com/embed/PGW-SgbEfGU,"
**Detailed How To:**- Grab the barbell with a shoulder width, underhand grip.- Flex at the elbows until your forearms press into your bicep (this will look different from person to person).- Begin to extend your elbows and control the weight during the eccentric part of the exercise.- Make sure to fully extend your elbows at the end of the rep.- Repeat until you hit muscular fatigue (1-3 reps left in the tank)**Ty's Tips**One of the drawbacks with a Barbell Curl is the bar limits Range of Motion somewhat. The bar will hit your legs before you can fully extend your arms. On most exercises, we want the longest Range or Motion possible. To remedy this,Push your butt back a tad bit. This will give you a little more room to fully extend your elbows.Watch out for cheating. Using momentum often naturally happens with a Barbell Curl (and most Dumbbell curl variations). There is a move called the Cheat Curl popularized by Arnold himself. But consider that a separate exercise.Root your feet to the floor and use a mirror to watch your form. If your hips begin moving and you're unable to continue to perform reps without any hip movement, end the set.A 6-12 rep range works well for this exercise.
",
1,Dumbbell Curl,"['https://media.musclewiki.com/media/uploads/videos/branded/male-dumbbell-curl-front.mp4#t=0.1', 'https://media.musclewiki.com/media/uploads/videos/branded/male-dumbbell-curl-side.mp4#t=0.1']","[""Stand up straight with a dumbbell in each hand at arm's length."", 'Raise one dumbbell and twist your forearm until it is vertical and your palm faces the shoulder.', 'Lower to original position and repeat with opposite arm']",Dumbbells,Beginner,Pull,Underhand,{'Primary': ['Biceps']},https://www.youtube.com/embed/P1FqV-oFn5M,"
How To Perform the Dumbbell Bicep CurlSetupGrab two dumbbells and stand tall with your shoulder blades pulled back and your chest poked out. You can start with either the dumbbells in front of your quads or off to the sides of your legs. Whichever is more comfortable. Also, whichever will allow you to fully extend your elbows at the bottom of each rep.Use a shoulder width or slightly inside of shoulder width stance. Performing Begin the rep by flexing your elbows. Try to touch your forearms to your biceps at the very top of the movement. Then begin the eccentric. Make sure to fully extend your elbows at the bottom of each rep so you get a full range of motion. It is easy to use momentum on a bicep curl. We want our muscles and not momentum to do the work. So make sure you keep these strict. If you find yourself swinging the weight up, then your biceps have hit fatigue and it's time to end the set.
",
2,Dumbbell Hammer Curl,"['https://media.musclewiki.com/media/uploads/videos/branded/male-dumbbell-hammer-curl-front.mp4#t=0.1', 'https://media.musclewiki.com/media/uploads/videos/branded/male-dumbbell-hammer-curl-side.mp4#t=0.1']","['Hold the dumbbells with a neutral grip (thumbs facing the ceiling).', 'Slowly lift the dumbbell up to chest height', 'Return to starting position and repeat.']",Dumbbells,Beginner,Pull,Neutral,{'Primary': ['Biceps']},https://www.youtube.com/embed/tvRlfjjH5NA,,
3,Kettlebell Goblet Curl,"['https://media.musclewiki.com/media/uploads/videos/branded/male-kettlebell-goblet-curl-front.mp4#t=0.1', 'https://media.musclewiki.com/media/uploads/videos/branded/male-kettlebell-goblet-curl-side.mp4#t=0.1']","['Stand up straight with a kettlebell in both hands in front of your pelvis.', 'Raise the kettlebell bending your arms at the elbow until the kettlebell is level with your chest.', 'Lower to the starting position and repeat.']",Kettlebells,Beginner,,,{'Primary': ['Biceps']},,,
4,Kettlebell Concentration Curl,"['https://media.musclewiki.com/media/uploads/videos/branded/male-kettlebell-concentration-curl-front.mp4#t=0.1', 'https://media.musclewiki.com/media/uploads/videos/branded/male-kettlebell-concentration-curl-side.mp4#t=0.1']","['Sitting on a chair with your legs apart, rest your arm against your thigh and hold the kettlebell with your arm extended towards the floor.', 'Bending your arm at the elbow, lift the kettlebell until your palm faces your shoulder.', 'Lower to the starting position and repeat.']",Kettlebells,Intermediate,Pull,Underhand,{'Primary': ['Biceps']},,,
5,Kettlebell Preacher Curl,"['https://media.musclewiki.com/media/uploads/videos/branded/male-kettlebell-preacher-curl-front.mp4#t=0.1', 'https://media.musclewiki.com/media/uploads/videos/branded/male-kettlebell-preacher-curl-side.mp4#t=0.1']","['Stand behind a bench, with your chest leaning over the edge of the bench.', 'With one arm resting on the bench, hold the kettlebell, bending the arm at the elbow.', 'Lower your arm using the bench as a guide, keeping your forearm straight.', 'Return to the starting position and repeat.']",Kettlebells,Intermediate,Pull,Underhand,{'Primary': ['Biceps']},,,
6,Kettlebell Single Arm Curl,"['https://media.musclewiki.com/media/uploads/videos/branded/male-kettlebell-single-arm-curl-front.mp4#t=0.1', 'https://media.musclewiki.com/media/uploads/videos/branded/male-kettlebell-single-arm-curl-side.mp4#t=0.1']","['Stand up straight with a kettlebell in one hand with your forearm facing out.', 'Raise the kettlebell, bending your arm at the elbow and keeping your forearm vertical until your palm faces the shoulder.', 'Lower to the starting position and repeat.']",Kettlebells,Beginner,,,{'Primary': ['Biceps']},,,
7,Biceps Stretch Variation Five,"['https://media.musclewiki.com/media/uploads/videos/branded/male-biceps-stretch-variation-5-front.mp4#t=0.1', 'https://media.musclewiki.com/media/uploads/videos/branded/male-biceps-stretch-variation-5-side.mp4#t=0.1']","['Stand upright with your feet shoulder width apart.', 'Raise your arms out to your sides, bringing them up to shoulder level.', 'Rotate your palms so they are facing the ceiling.', 'Then, change direction and rotate the arms as much as you can.']",Stretches,Beginner,,None,{'Primary': ['Biceps']},,,
8,Biceps Stretch Variation Four,"['https://media.musclewiki.com/media/uploads/videos/branded/male-biceps-stretch-variation-4-front.mp4#t=0.1', 'https://media.musclewiki.com/media/uploads/videos/branded/male-biceps-stretch-variation-4-side.mp4#t=0.1']","['Stand an arms width away from the wall.', 'Raise your arms out behind you, and place them on the wall with your fingers pointing up.', 'Bend your knees whilst keeping your hands in the same position.']",Stretches,Beginner,,None,{'Primary': ['Biceps']},,,
9,Biceps Stretch Variation Three,"['https://media.musclewiki.com/media/uploads/videos/branded/male-biceps-stretch-variation-3-front.mp4#t=0.1', 'https://media.musclewiki.com/media/uploads/videos/branded/male-biceps-stretch-variation-3-side.mp4#t=0.1']","['Bend your arm at the elbow, raising your hand to your shoulder.', 'Using your other hand, stretch the arm down to its full extent.']",Stretches,Beginner,,None,{'Primary': ['Biceps']},,,
10,Biceps Stretch Variation Two,"['https://media.musclewiki.com/media/uploads/videos/branded/male-biceps-stretch-variation-2-front.mp4#t=0.1', 'https://media.musclewiki.com/media/uploads/videos/branded/male-biceps-stretch-variation-2-side.mp4#t=0.1']","[""Stand facing the wall, an arm's width away."", 'Place your hand on the wall with your fingers pointing down.', 'Lean slightly into the wall to feel the stretch in your bicep.']",Stretches,Beginner,,None,{'Primary': ['Biceps']},,,
11,Biceps Stretch Variation One,"['https://media.musclewiki.com/media/uploads/videos/branded/male-biceps-stretch-variation-1-front.mp4#t=0.1', 'https://media.musclewiki.com/media/uploads/videos/branded/male-biceps-stretch-variation-1-side.mp4#t=0.1']","['Stand one foot in front of the other with the wall to your right, an arms width away.', 'Place your hand on the wall, fingers pointing away from you.', 'Gently lean forward, keeping your hand stationary.', 'Repeat with the other arm.']",Stretches,Beginner,,None,{'Primary': ['Biceps']},,,
12,Cable Twisting Curl,"['https://media.musclewiki.com/media/uploads/videos/branded/male-cable-twisting-curl-front.mp4#t=0.1', 'https://media.musclewiki.com/media/uploads/videos/branded/male-cable-twisting-curl-side.mp4#t=0.1']","['Use a handle attachment. The cable should be set all the way to the bottom of the machine.', 'Face away from the cable machine. Stagger your stance so you have a better base of support.', 'Start with a neutral grip. Flex at the elbow. While flexing twist your palm. When you hit the top of the movement your palm should be facing upward.']",Cables,Advanced,,,{'Primary': ['Biceps']},,,
13,Cable Bayesian Curl,"['https://media.musclewiki.com/media/uploads/videos/branded/male-cable-bayesian-curl-front.mp4#t=0.1', 'https://media.musclewiki.com/media/uploads/videos/branded/male-cable-bayesian-curl-side.mp4#t=0.1']","['Use a handle attachment. The cable should be set all the way to the bottom of the machine.', 'Face away from the cable machine.', 'Stagger your stance so you have a better base of support. Face your palm forward. Flex at the elbow and extend.']",Cables,Beginner,Pull,Underhand,{'Primary': ['Biceps']},,,
14,Cable Reverse Curl,"['https://media.musclewiki.com/media/uploads/videos/branded/male-cable-reverse-curl-front.mp4#t=0.1', 'https://media.musclewiki.com/media/uploads/videos/branded/male-cable-reverse-curl-side.mp4#t=0.1']","['Use a handle attachment. The cable should be set all the way to the bottom of the machine.', 'Face away from the cable machine. Stagger your stance so you have a better base of support.', 'Face your palm downwards. Flex at the elbow and extend.']",Cables,Intermediate,,,"{'Primary': ['Biceps'], 'Secondary': ['Forearms']}",,,
15,Cable Hammer Curl,"['https://media.musclewiki.com/media/uploads/videos/branded/male-cable-hammer-curl-front.mp4#t=0.1', 'https://media.musclewiki.com/media/uploads/videos/branded/male-cable-hammer-curl-side.mp4#t=0.1']","['Use a handle attachment. The cable should be set all the way to the bottom of the machine.', 'Face away from the cable machine. Stagger your stance so you have a better base of support.', 'Use a neutral grip thumb facing up pinky-facing down). Flex at the elbow and extend.']",Cables,Beginner,Pull,Neutral,{'Primary': ['Biceps']},https://www.youtube.com/embed/tvRlfjjH5NA,,
16,Band Bayesian Curl,"['https://media.musclewiki.com/media/uploads/videos/branded/male-band-curl-front.mp4#t=0.1', 'https://media.musclewiki.com/media/uploads/videos/branded/male-band-curl-side.mp4#t=0.1']","['Attach band to a low anchor point. Point your palms straight forward.', 'Flex your elbow until you feel your biceps contract. Then fully extend elbows.']",Band,Beginner,,,{'Primary': ['Biceps']},,,
17,Band Bayesian Hammer Curl,"['https://media.musclewiki.com/media/uploads/videos/branded/male-band-hammer-curl-front.mp4#t=0.1', 'https://media.musclewiki.com/media/uploads/videos/branded/male-band-hammer-curl-side.mp4#t=0.1']","['Attach band to a low anchor point. Use a neutral grip.', 'Flex your elbow until you feel your biceps contract. Then fully extend elbows.']",Band,Intermediate,,,"{'Primary': ['Biceps', 'Forearms']}",https://www.youtube.com/embed/tvRlfjjH5NA,,
18,Band Bayesian Reverse Curl,"['https://media.musclewiki.com/media/uploads/videos/branded/male-band-reverse-curl-front.mp4#t=0.1', 'https://media.musclewiki.com/media/uploads/videos/branded/male-band-reverse-curl-side.mp4#t=0.1']","['Attach band to a low anchor point. . Point your palms toward your thighs.', 'Flex your elbow until you feel your biceps contract. Then fully extend elbows.']",Band,Intermediate,,,"{'Primary': ['Biceps'], 'Secondary': ['Forearms']}",,,
19,Dumbbell Reverse Curl,"['https://media.musclewiki.com/media/uploads/videos/branded/male-dumbbell-reverse-curl-front.mp4#t=0.1', 'https://media.musclewiki.com/media/uploads/videos/branded/male-dumbbell-reverse-curl-side.mp4#t=0.1']","[""Grab the dumbbells with a pronated (overhand) grip. You can do this exercise thumbless if it's more comfortable on your wrists."", 'Flex at the elbows until your biceps touch your forearms. Try not to let your elbows flair outward.']",Dumbbells,Intermediate,Pull,Overhand,"{'Primary': ['Biceps'], 'Secondary': ['Forearms']}",,,
20,Barbell Reverse Curl,"['https://media.musclewiki.com/media/uploads/videos/branded/male-barbell-reverse-curl-front.mp4#t=0.1', 'https://media.musclewiki.com/media/uploads/videos/branded/male-barbell-reverse-curl-side.mp4#t=0.1']","[""Take a double overhand grip that's about shoulder width. Flex your elbows while keeping your elbows tucked in. Try not to let them flare out."", 'Curl until your forearm presses into your bicep. Then fully extend your elbows at the bottom of each rep.']",Barbell,Advanced,Pull,Overhand,"{'Primary': ['Biceps'], 'Secondary': ['Forearms']}",,"

Barbell Reverse Curl: A Comprehensive Guide
Setup

Select a barbell with the appropriate weight for your strength level
Stand with your feet shoulder-width apart and grip the barbell with a shoulder-width overhand grip
Keep your arms straight and the barbell hanging at arm's length in front of your thighs

How to Perform

Breathe in and tighten your core
Curl the barbell upwards towards your chest, keeping your upper arms stationary and your elbows tucked in close to your torso
Hold the contraction at the top for a count of one
Lower the barbell back down to the starting position with control, inhaling as you do so
Repeat the movement for the desired number of reps

Technique

Keep your movements smooth and controlled throughout the exercise
Avoid using momentum to swing the barbell up and down
Keep your head and neck in a neutral position, looking straight ahead and avoiding any unnecessary neck strain
Engage your shoulder blades and keep your shoulders down and away from your ears

Things to Avoid

Using a weight that is too heavy and sacrificing form
Arching your back or swaying excessively
Locking out your elbows at the top of the movement
Allowing your elbows to flare out to the sides

",
21,Dumbbell Incline Hammer Curl,"['https://media.musclewiki.com/media/uploads/videos/branded/male-dumbbell-incline-hammer-curl-front.mp4#t=0.1', 'https://media.musclewiki.com/media/uploads/videos/branded/male-dumbbell-incline-hammer-curl-side.mp4#t=0.1']","['Hold the dumbbells with a neutral grip (thumbs facing the ceiling). Seated on an incline bench.', 'Slowly lift the dumbbell up to chest height', 'Return to starting position and repeat.']",Dumbbells,Beginner,Pull,Neutral,{'Primary': ['Biceps']},https://www.youtube.com/embed/tvRlfjjH5NA,,
22,Dumbbell Incline Reverse Curl,"['https://media.musclewiki.com/media/uploads/videos/branded/male-dumbbell-incline-reverse-curl-front.mp4#t=0.1', 'https://media.musclewiki.com/media/uploads/videos/branded/male-dumbbell-incline-reverse-curl-side.mp4#t=0.1']","['Lay on an incline bench.', ""Grab the dumbbells with a pronated (overhand) grip. You can do this exercise thumbless if it's more comfortable on your wrists."", 'Flex at the elbows until your biceps touch your forearms. Try not to let your elbows flair outward.']",Dumbbells,Beginner,Pull,Overhand,"{'Primary': ['Biceps'], 'Secondary': ['Forearms']}",,,
23,Dumbbell Incline Zottman Curl,"['https://media.musclewiki.com/media/uploads/videos/branded/male-dumbbell-incline-zottman-curl-front.mp4#t=0.1', 'https://media.musclewiki.com/media/uploads/videos/branded/male-dumbbell-incline-zottman-curl-side.mp4#t=0.1']","['Lay on an incline bench with your palms facing forward.', 'Flex at the elbows until your forearms touch your biceps.', 'When you hit the top of the movement, rotate your palms and then lower the dumbbells slowly.']",Dumbbells,Intermediate,Pull,Rotating,"{'Primary': ['Biceps'], 'Secondary': ['Forearms']}",,,
24,Dumbbell Single Arm Preacher Curl,"['https://media.musclewiki.com/media/uploads/videos/branded/male-dumbbell-single-arm-preacher-curl-front.mp4#t=0.1', 'https://media.musclewiki.com/media/uploads/videos/branded/male-dumbbell-single-arm-preacher-curl-side.mp4#t=0.1']","['Start with a with a dumbbell in one hand and your elbow resting on the bench.', 'From this starting position, curl the dumbbell up towards your shoulder, keeping your upper arm stationary on the bench.']",Dumbbells,Beginner,Pull,Underhand,{'Primary': ['Biceps']},,,
25,Dumbbell Single Arm Spider Curl,"['https://media.musclewiki.com/media/uploads/videos/branded/male-dumbbell-single-arm-spider-curl-front.mp4#t=0.1', 'https://media.musclewiki.com/media/uploads/videos/branded/male-dumbbell-single-arm-spider-curl-side.mp4#t=0.1']","['Lay on an incline or preacher curl bench.', 'Let your arms hang freely off the edge of the bench.', 'Fully flex your elbow and fully extend your elbow on each rep.']",Dumbbells,Beginner,Pull,Underhand,{'Primary': ['Biceps']},,,
26,Dumbbell Spider Curl,"['https://media.musclewiki.com/media/uploads/videos/branded/male-dumbbell-spider-curl-front.mp4#t=0.1', 'https://media.musclewiki.com/media/uploads/videos/branded/male-dumbbell-spider-curl-side.mp4#t=0.1']","['Start by placing your forearms on a flat bench and holding a dumbbell in each hand.', 'From this starting position, curl the dumbbells up towards your shoulders, keeping your elbows close to your body and your core engaged.', 'Slowly lower the dumbbells back down to the starting position, and repeat for the desired number of repetitions.']",Dumbbells,Beginner,Pull,Underhand,{'Primary': ['Biceps']},,,
27,Dumbbell Twisting Curl,"['https://media.musclewiki.com/media/uploads/videos/branded/male-dumbbell-twisting-curl-front.mp4#t=0.1', 'https://media.musclewiki.com/media/uploads/videos/branded/male-dumbbell-twisting-curl-side.mp4#t=0.1']","['Start by standing with your feet shoulder-width apart and holding a dumbbell in each hand.', 'Bring the dumbbells to your sides, with your palms facing inward and your elbows bent.', 'From this starting position, curl the dumbbells up towards your shoulders while rotating your wrists so that your palms face your shoulders at the top of the movement.']",Dumbbells,Beginner,Pull,Rotating,{'Primary': ['Biceps']},,,
28,Plate Bicep Curl,"['https://media.musclewiki.com/media/uploads/videos/branded/male-plate-bicep-curl-front.mp4#t=0.1', 'https://media.musclewiki.com/media/uploads/videos/branded/male-plate-bicep-curl-side.mp4#t=0.1']",[],Plate,Beginner,Pull,Neutral,{'Primary': ['Biceps']},,,
29,Plate Curl To Overhead Press,"['https://media.musclewiki.com/media/uploads/videos/branded/male-plate-curl-to-overhead-press-front_kQDPle2.mp4#t=0.1', 'https://media.musclewiki.com/media/uploads/videos/branded/male-plate-curl-to-overhead-press-side.mp4#t=0.1']","['Stand with feet shoulder-width apart and the plate in front of the torso, palms facing forward.', 'Curl the plate up to the front of the shoulder while keeping the elbows close to the body.', 'Rotate the palms to face forward and press the plate overhead, locking out the arms.', 'Lower the plate back to the starting position, keeping control of it, and repeat for desired reps.']",Plate,Intermediate,Push,Neutral,"{'Primary': ['Biceps'], 'Secondary': ['Shoulders']}",,,
30,Plate Curl To Overhead Press To Tricep Extension,"['https://media.musclewiki.com/media/uploads/videos/branded/male-plate-curl-to-overhead-press-to-tricep-extension-front_LMFCnKf.mp4#t=0.1', 'https://media.musclewiki.com/media/uploads/videos/branded/male-plate-curl-to-overhead-press-to-tricep-extension-side_ax0yvwM.mp4#t=0.1']","['Stand with feet shoulder-width apart and the plate in front of the torso, palms facing forward.', 'Curl the plate up to the front of the shoulder while keeping the elbows close to the body.', 'Rotate the palms to face forward and press the plate overhead, locking out the arms.', 'Lower the plate back behind the head to the starting position of a tricep extension.', 'Push the plate back up overhead, then lower it back to the starting position and repeat for desired reps.']",Plate,Advanced,,Neutral,"{'Primary': ['Biceps', 'Triceps'], 'Secondary': ['Shoulders']}",,,
31,Plate Squat Hold Curl,"['https://media.musclewiki.com/media/uploads/videos/branded/male-plate-squat-hold-curl-front.mp4#t=0.1', 'https://media.musclewiki.com/media/uploads/videos/branded/male-plate-squat-hold-curl-side.mp4#t=0.1']","['Lower into a squat position, keeping the plate at chest height.', 'Slowly curl the plate towards your shoulders, keeping your elbows close to your body.', 'Hold for a moment at the top of the curl before lowering the plate back to chest height.', 'Repeat the curls as you hold the squat position.']",Plate,Intermediate,,,"{'Primary': ['Biceps'], 'Secondary': ['Quads', 'Glutes']}",,,
32,Band High Curl,"['https://media.musclewiki.com/media/uploads/videos/branded/male-band-high-curl-front.mp4#t=0.1', 'https://media.musclewiki.com/media/uploads/videos/branded/male-band-high-curl-side.mp4#t=0.1']","['Anchor a band to a high point.', 'Start with your feet staggered and your elbows high.', 'Flex your elbows while keeping your arms high. Curl the band to your forehead.']",Band,Beginner,Pull,Underhand,{'Primary': ['Biceps']},,,
33,Band High Hammer Curl,"['https://media.musclewiki.com/media/uploads/videos/branded/male-band-high-hammer-curl-front.mp4#t=0.1', 'https://media.musclewiki.com/media/uploads/videos/branded/male-band-high-hammer-curl-side.mp4#t=0.1']","['Start with the band anchored to something high with your feet staggered and a neutral grip.', 'Keep your elbows high. Curl until your fists are at your forehead.']",Band,Beginner,Pull,Neutral,{'Primary': ['Biceps']},https://www.youtube.com/embed/tvRlfjjH5NA,,
34,Band High Reverse Curl,"['https://media.musclewiki.com/media/uploads/videos/branded/male-band-high-reverse-curl-front.mp4#t=0.1', 'https://media.musclewiki.com/media/uploads/videos/branded/male-band-high-reverse-curl-side.mp4#t=0.1']","['Start with a band attached to a high point, your feet staggered, and an overhand grip.', 'Flex your elbows pulling your forearms to your biceps. Your fists should land by your forehead.']",Band,Intermediate,Pull,Overhand,"{'Primary': ['Biceps'], 'Secondary': ['Forearms']}",,,
35,Band Curl,"['https://media.musclewiki.com/media/uploads/videos/branded/male-band-curl-front_1YwVVEx.mp4#t=0.1', 'https://media.musclewiki.com/media/uploads/videos/branded/male-band-curl-side_qegXZDv.mp4#t=0.1']","['Stand with your feet shoulder-width apart, with the band under both feet.', 'Grasp the handles of the band with both hands, keeping your arms straight and extended in front of you.', 'Keep your back straight, abs engaged, and shoulders relaxed as you curl your hands towards your shoulders, bending at the elbows.']",Band,Beginner,Pull,Underhand,{'Primary': ['Biceps']},,,
36,Band Reverse Curl,"['https://media.musclewiki.com/media/uploads/videos/branded/male-band-reverse-curl-front_iQSuy66.mp4#t=0.1', 'https://media.musclewiki.com/media/uploads/videos/branded/male-band-reverse-curl-side_Cez320W.mp4#t=0.1']","['Start by standing on the center of the band with both feet, shoulder-width apart.', 'Hold the band with both hands, palms facing down, arms extended straight in front of you.', 'Slowly curl your hands towards your shoulders, pulling the band tight, then lower your arms back to the starting position, keeping tension on the band throughout the exercise.']",Band,Intermediate,Pull,Overhand,"{'Primary': ['Biceps'], 'Secondary': ['Forearms']}",,,
37,Dumbbell Concentration Curl,"['https://media.musclewiki.com/media/uploads/videos/branded/male-dumbbell-concentration-curl-front.mp4#t=0.1', 'https://media.musclewiki.com/media/uploads/videos/branded/male-dumbbell-concentration-curl-side.mp4#t=0.1']","['Sit on a flat bench with your feet flat on the floor and your back straight.', 'Lean forward and place your elbow on the inside of your leg.', 'Curl the dumbbell while keeping your elbow against your leg. Make sure to fully extend your elbow on each rep.']",Dumbbells,Beginner,Pull,Underhand,{'Primary': ['Biceps']},,,
38,TRX Curl,"['https://media.musclewiki.com/media/uploads/videos/branded/male-trx-curl-front.mp4#t=0.1', 'https://media.musclewiki.com/media/uploads/videos/branded/male-trx-curl-side.mp4#t=0.1']","['Hold the TRX straps with an underhand grip and lean back and away from the anchor point.', 'Keep your elbows high as you flex your elbows. Pull your fists toward your forehead.']",TRX,Beginner,Pull,Underhand,{'Primary': ['Biceps']},,,
39,TRX Hammer Curl,"['https://media.musclewiki.com/media/uploads/videos/branded/male-trx-hammer-curl-side.mp4#t=0.1', 'https://media.musclewiki.com/media/uploads/videos/branded/male-trx-hammer-curl-front.mp4#t=0.1']","['Grab the TRX straps and lean away from the anchor point.', 'Maintain a neutral grip. Flex your elbows and pull your fists to either sides of your temples.']",TRX,Beginner,Pull,,{'Primary': ['Biceps']},https://www.youtube.com/embed/tvRlfjjH5NA,,
