id,exercise_name,videoURL,steps,Category,Difficulty,Force,Grips,target,youtubeURL,details,Aka
466,Barbell Meadows Row,"['https://media.musclewiki.com/media/uploads/videos/branded/male-barbell-meadows-row-side.mp4#t=0.1', 'https://media.musclewiki.com/media/uploads/videos/branded/male-barbell-meadows-row-front.mp4#t=0.1']","['Position a barbell in a landmine or corner of a room and stand facing sideways with a staggered stance and your feet shoulder-width apart.', 'Grasp the end of the barbell with an overhand grip, keeping your arms straight and your shoulders relaxed.', 'Bend at the hips and knees to lower your torso until it is almost parallel to the ground.', 'Pull the barbell towards your chest, squeezing your shoulder blades together as you row the weight up.', '*Named after the late John Meadows']",Barbell,Intermediate,Pull,Overhand,"{'Primary': ['Lats'], 'Secondary': ['Biceps'], 'Tertiary': ['Forearms']}",,,
467,Barbell Pronated Pendlay Row,"['https://media.musclewiki.com/media/uploads/videos/branded/male-barbell-pronated-pendlay-row-front.mp4#t=0.1', 'https://media.musclewiki.com/media/uploads/videos/branded/male-barbell-pronated-pendlay-row-side.mp4#t=0.1']","['Start hinged forward with a flat back and the plates resting on the floor. Make sure your elbows are fully extended.', 'Pull the bar to your sternum.', 'Return the plates back to the floor and let the bar come to a full dead stop.', 'Then initiate the next rep.']",Barbell,Advanced,Pull,Overhand,"{'Primary': ['Lats'], 'Secondary': ['Biceps'], 'Tertiary': ['Lower back']}",,,
468,Barbell Pronated Row,"['https://media.musclewiki.com/media/uploads/videos/branded/male-barbell-pronated-row-front.mp4#t=0.1', 'https://media.musclewiki.com/media/uploads/videos/branded/male-barbell-pronated-row-side.mp4#t=0.1']","['Grab the barbell with an overhand grip. Hinge forward while keeping your back flat until your torso is about parallel with the ground.', 'Let your arms hang freely.', 'Pull the bar to your torso while tucking your elbows in slightly.', 'Extend your elbows fully before initiating the next rep.']",Barbell,Beginner,Pull,Overhand,"{'Primary': ['Lats'], 'Secondary': ['Biceps'], 'Tertiary': ['Forearms']}",,,
469,Barbell Supinated Pendlay Row,"['https://media.musclewiki.com/media/uploads/videos/branded/male-barbell-supinated-pendlay-row-front.mp4#t=0.1', 'https://media.musclewiki.com/media/uploads/videos/branded/male-barbell-supinated-pendlay-row-side.mp4#t=0.1']","['Begin by standing in front of a barbell with your feet about hip-width apart and your palms facing towards your body.', 'Bend at the hips and knees to grab the barbell with a pronated (overhand) grip, positioning the barbell about an inch away from your shins.', 'Keeping your back straight and your core engaged, use your back muscles to lift the barbell straight up towards your chest.', 'As the barbell reaches your chest, rotate your wrists so that your palms are facing towards your body (supinated grip), and then lower the barbell back to the starting position.']",Barbell,Advanced,Pull,Underhand,"{'Primary': ['Lats'], 'Secondary': ['Biceps'], 'Tertiary': ['Lower back']}",,,
470,Barbell Supinated Row,"['https://media.musclewiki.com/media/uploads/videos/branded/male-barbell-supinated-row-front.mp4#t=0.1', 'https://media.musclewiki.com/media/uploads/videos/branded/male-barbell-supinated-row-side.mp4#t=0.1']","['Begin by standing in front of a barbell with your feet about hip-width apart.', 'Bend at the hips and knees to grab the barbell with a supinated (underhand) grip, positioning the barbell about an inch away from your shins.', 'Keeping your back straight and your core engaged, use your back muscles to lift the barbell straight up towards your chest.', 'As the barbell reaches your chest, pause briefly, and then lower the barbell back to the starting position.']",Barbell,Advanced,Pull,Underhand,"{'Primary': ['Lats', 'Lower back'], 'Secondary': ['Biceps']}",,,
471,Dumbbell Pullover,"['https://media.musclewiki.com/media/uploads/videos/branded/male-dumbbell-pullover-front.mp4#t=0.1', 'https://media.musclewiki.com/media/uploads/videos/branded/male-dumbbell-pullover-side.mp4#t=0.1']","['Grab a dumbbell and hold with both hands. Point your dumbbell at the ceiling.', 'Flex at the shoulder joint while keeping your elbows mostly extended.', 'Flex until you feel a stretch in your lats then bring the dumbbell back to the ceiling.']",Dumbbells,Intermediate,Pull,Neutral,{'Primary': ['Lats']},,,
472,Dumbbell Alternating Pendlay Row,"['https://media.musclewiki.com/media/uploads/videos/branded/male-dumbbell-alternating-pendlay-row-front.mp4#t=0.1', 'https://media.musclewiki.com/media/uploads/videos/branded/male-dumbbell-alternating-pendlay-row-side.mp4#t=0.1']","['The dumbbells should be set on the ground. Hinge forward while keeping a flat back.', 'Pull one elbow back toward the ceiling and then return the dumbbell to the ground softly.', 'Then pull with the other arm.']",Dumbbells,Advanced,Pull,Neutral,"{'Primary': ['Lats'], 'Secondary': ['Biceps']}",,,
473,Dumbbell Kneeling Single Arm Row,"['https://media.musclewiki.com/media/uploads/videos/branded/male-dumbbell-kneeling-single-arm-row-front.mp4#t=0.1', 'https://media.musclewiki.com/media/uploads/videos/branded/male-dumbbell-kneeling-single-arm-row-side.mp4#t=0.1']","['Place one hand and one knee on a bench. Make sure you keep a flat back.', 'Pull the dumbbell toward the ceiling.', 'Make sure to avoid any jerking or rotating.']",Dumbbells,Beginner,Pull,Neutral,"{'Primary': ['Lats'], 'Secondary': ['Biceps']}",,,
474,Dumbbell Laying Incline Row,"['https://media.musclewiki.com/media/uploads/videos/branded/male-dumbbell-laying-incline-row-front.mp4#t=0.1', 'https://media.musclewiki.com/media/uploads/videos/branded/male-dumbbell-laying-incline-row-side.mp4#t=0.1']","['Lay on an incline bench that is between 30-45 degrees high.', 'Let your arms hang freely. Pull your elbows straight back toward the ceiling.']",Dumbbells,Beginner,Pull,Neutral,"{'Primary': ['Lats'], 'Secondary': ['Biceps']}",,,
475,Dumbbell Pendlay Row,"['https://media.musclewiki.com/media/uploads/videos/branded/male-dumbbell-pendlay-row-front.mp4#t=0.1', 'https://media.musclewiki.com/media/uploads/videos/branded/male-dumbbell-pendlay-row-side.mp4#t=0.1']","['The dumbbells should be placed on the floor.', 'Hinge forward with a flat back and grab the dumbbells.', 'Pull both dumbbells back and your elbows toward the ceiling.', 'Return the dumbbells back to the floor softly on each rep.']",Dumbbells,Intermediate,Pull,Neutral,"{'Primary': ['Lats'], 'Secondary': ['Biceps']}",,,
476,Dumbbell Renegade Row,"['https://media.musclewiki.com/media/uploads/videos/branded/male-dumbbell-renegade-row-front.mp4#t=0.1', 'https://media.musclewiki.com/media/uploads/videos/branded/male-dumbbell-renegade-row-side.mp4#t=0.1']","['Start by getting into a plank position with a dumbbell in each hand. Your feet should be shoulder-width apart and your hands should be placed on the dumbbells, with your palms facing each other.', 'From this starting position, row one dumbbell up towards your chest, keeping your elbow close to your body and your core engaged.', 'Slowly lower the dumbbell back down to the starting position, and repeat on the other side.', 'Make sure to keep your body straight and your hips level throughout the movement.']",Dumbbells,Intermediate,Pull,Neutral,"{'Primary': ['Lats'], 'Secondary': ['Abdominals']}",,,
477,Dumbbell Shoulder Extension,"['https://media.musclewiki.com/media/uploads/videos/branded/male-dumbbell-shoulder-extension-front.mp4#t=0.1', 'https://media.musclewiki.com/media/uploads/videos/branded/male-dumbbell-shoulder-extension-side.mp4#t=0.1']","['Start by hinging over with your feet shoulder-width apart and holding a dumbbell in each hand.', 'Bring the dumbbells to your sides, with your palms facing forward and your elbows slightly bent.', 'Make sure to keep your core engaged and your back straight throughout the movement.']",Dumbbells,Intermediate,Pull,Neutral,{'Primary': ['Lats']},,,
478,Dumbbell Single Arm Row,"['https://media.musclewiki.com/media/uploads/videos/branded/male-dumbbell-single-arm-row-front.mp4#t=0.1', 'https://media.musclewiki.com/media/uploads/videos/branded/male-dumbbell-single-arm-row-side.mp4#t=0.1']","['Make sure to keep your elbow close to your body and your core engaged throughout the movement.', 'Start by standing in front of a flat bench with your feet shoulder-width apart and holding a dumbbell in one hand.', 'Place your other hand on the bench for support, and bend at the waist so that your chest is parallel to the ground.', 'From this starting position, row the dumbbell up towards your chest, squeezing your shoulder blade together as you do so.']",Dumbbells,Beginner,Pull,Neutral,"{'Primary': ['Lats'], 'Secondary': ['Biceps']}",,,
479,Dumbbell Single Arm Row Knee,"['https://media.musclewiki.com/media/uploads/videos/branded/male-dumbbell-single-arm-row-knee-front.mp4#t=0.1', 'https://media.musclewiki.com/media/uploads/videos/branded/male-dumbbell-single-arm-row-knee-side.mp4#t=0.1']","['Start by placing your elbow on one knee.', 'Hold a dumbbell in your other hand, with your palm facing inwards towards your body.', 'From this starting position, row the dumbbell up towards your chest, keeping your elbow close to your body and your core engaged.']",Dumbbells,Beginner,Pull,Neutral,"{'Primary': ['Lats'], 'Secondary': ['Biceps']}",,,
480,Plate Alternating Deadstop Row,"['https://media.musclewiki.com/media/uploads/videos/branded/female-plate-alternating-deadstop-row-front.mp4#t=0.1', 'https://media.musclewiki.com/media/uploads/videos/branded/female-plate-alternating-deadstop-row-side.mp4#t=0.1']","['Stand with your feet shoulder width apart. Hold each plate to the side of you.', 'Bend forward at the hips bringing the plates to the floor while you slightly bend your knees, keeping your back straight.', 'One at a time, lift the plate up. Return the plate to the floor and do the other side.']",Plate,Intermediate,Pull,Neutral,{'Primary': ['Lats']},,,
481,Plate Glute Bridge to Pullover,"['https://media.musclewiki.com/media/uploads/videos/branded/male-plate-glute-bridge-pullover-front.mp4#t=0.1', 'https://media.musclewiki.com/media/uploads/videos/branded/male-plate-glute-bridge-pullover-side.mp4#t=0.1']","['Lay flat on the ground with a plate on your chest.', 'Push your hips up toward the ceiling and maintain that extended position.', 'Extend your elbows mostly, break at the shoulder joint while maintaining hip extension and the slight bend in your elbows.', 'Let the plate tap the floor (or get close) and then pull the plate back into the starting position.']",Plate,Beginner,Pull,Neutral,"{'Primary': ['Lats'], 'Secondary': ['Glutes']}",,,
482,Lawnmower Row,"['https://media.musclewiki.com/media/uploads/videos/branded/male-dumbbell-bench-lawnmower-row-front.mp4#t=0.1', 'https://media.musclewiki.com/media/uploads/videos/branded/male-dumbbell-bench-lawnmower-row-side.mp4#t=0.1']","['Stand with feet staggered and one hand on a bench/box. Hold a dumbbell in the opposing hand.', 'Hinge forward at the hips, keeping the back flat, and eyes facing forward. The weight should hang directly below the shoulders.', 'Start with an overhand grip, as you pull rotate the dumbbell. When your upper arm reaches your side your palm should be facing forward.']",Dumbbells,Intermediate,Pull,Rotating,"{'Primary': ['Lats'], 'Secondary': ['Biceps']}",,,
483,Dumbbell Knee Lawnmower Row,"['https://media.musclewiki.com/media/uploads/videos/branded/male-dumbbell-knee-lawnmower-row-front.mp4#t=0.1', 'https://media.musclewiki.com/media/uploads/videos/branded/male-dumbbell-knee-lawnmower-row-side.mp4#t=0.1']","['Stand with feet staggered and one hand on your knee. Hold a dumbbell in the opposing hand.', 'Hinge forward at the hips, keeping the back flat, and eyes facing forward. The weight should hang directly below the shoulders.', 'Start with an overhand grip, as you pull rotate the dumbbell. When your upper arm reaches your side your palm should be facing forward.']",Dumbbells,Intermediate,Pull,Rotating,"{'Primary': ['Lats'], 'Secondary': ['Biceps']}",,,
484,Dumbbell Supinated Row,"['https://media.musclewiki.com/media/uploads/videos/branded/male-dumbbell-supinated-row-front.mp4#t=0.1', 'https://media.musclewiki.com/media/uploads/videos/branded/male-dumbbell-supinated-row-side.mp4#t=0.1']","['Grab both dumbbells and hinge forward at the hips. Make sure you keep a flat back.', ""The closer your torso is to parallel with the ground the longer the range of motion will be at your shoulder. The better the results you'll get from the exercise."", 'Let your arms hang freely, maintain an underhand grip, and then pull your elbow joint straight back toward the ceiling.']",Dumbbells,Beginner,Pull,Underhand,"{'Primary': ['Lats'], 'Secondary': ['Biceps']}",,,
485,TRX Rotating Row,"['https://media.musclewiki.com/media/uploads/videos/branded/male-trx-rotating-row-front.mp4#t=0.1', 'https://media.musclewiki.com/media/uploads/videos/branded/male-trx-rotating-row-side.mp4#t=0.1']","['Grab the TRX straps and lean away from the anchor point until the strap is taut.', 'Start with an overhand grip. Pull your elbows back and rotate your grip.', 'By the time your elbows reach your side, your palms should be facing upwards.']",TRX,Beginner,Pull,Rotating,"{'Primary': ['Lats'], 'Secondary': ['Biceps']}",,,
486,TRX Single Arm row,"['https://media.musclewiki.com/media/uploads/videos/branded/male-trx-single-arm-row-front.mp4#t=0.1', 'https://media.musclewiki.com/media/uploads/videos/branded/male-trx-single-arm-row-side.mp4#t=0.1']","['Hold the TRX strap with one hand.', 'Lean back until the strap is taut. Fully extend your elbow.', 'Pull your elbow behind the body. Make sure to avoid twisting. Try to keep your shoulders even.']",TRX,Intermediate,Pull,Neutral,{'Primary': ['Lats']},,,
487,Chin Ups,"['https://media.musclewiki.com/media/uploads/videos/branded/male-bodyweight-chinup-front.mp4#t=0.1', 'https://media.musclewiki.com/media/uploads/videos/branded/male-bodyweight-chinup-side.mp4#t=0.1']","['Grab the bar shoulder width apart with a supinated grip (palms facing you)', 'With your body hanging and arms fully extended, pull yourself up until your chin is past the bar.', 'Slowly return to starting position. Repeat.']",Bodyweight,Intermediate,Pull,Underhand,"{'Primary': ['Lats'], 'Secondary': ['Biceps'], 'Tertiary': ['Forearms']}",https://www.youtube.com/embed/y6x0AIhgjsM,"
How To Perform The Chin UpSetupGrab the Chin Up bar with an underhand grip. Make sure the bars are set very deeply in your hand. Your palms should be making contact with the bar. Next, if you are using a bench or box to reach the Chin Up bars, step off of the step, and hold for a second, in a dead hang position. If you begin initiating the reps before the dead hang, you might swing too much to perform the exercise strictly. If you can reach the bars without having to stand on anything, take your grip and then pull your feet slightly off the floor. Still hold for a second to prevent any swinging from happening.Pull your shoulder blades down. This will engage your mid and lower traps and force your lats to do most of the work. Also, before beginning the first rep, make sure your elbows are extended.Lower bodyAngle your legs forward slightly, push your hips back, and point your toes. This will force you to flex your abdominals and keep you more stable throughout the rep. (This will massively help you keep the reps strict).PerformingOnce you are in the proper position, begin to pull. Imagine trying to pull your elbows straight down to your sides.Get your chin over the bar before beginning the eccentric portion of the rap. Your elbows should fully extend at the bottom of each rep.Progressing The Chin UpDecide on a rep range. For example, 6 to 10. Once you are able to perform 10 reps with strict form, then it is time to progress. Do not be shy or hesitant to start adding weight early on. Even if it is only 5 pounds. Progress is progress! From there, progress like you would any other exercise. Once you hit the top end of the rep range, add some more weight.The best way to get better at doing Chin Ups is to do Chin Ups. But if you can't do them in the first place, then what should you do? Try the Neutral Grip Chin Up. It’s an easier variation because the lats are in their strongest position.Shorten the range of motion, and try to get a longer range of motion overtime. if you can only do half a Chin Up, (meaning you can get your elbows to roughly 90°) don't be ashamed to do those half reps. Set a rep range like with anything else. We will use 5 to 8 reps for this example. Once you are able to hit 8 of the half reps, try to go an extra 2 to 3 inches higher on each rep. You won't be able to do 8 when you advance the range of motion. So Build your way back up to 8. It helps massively if you can do this in front of a mirror to keep a very close eye on your range of motion. Before long you'll be able to perform full reps.
",
488,Barbell Landmine Row,"['https://media.musclewiki.com/media/uploads/videos/branded/male-barbell-landmine-row-front.mp4#t=0.1', 'https://media.musclewiki.com/media/uploads/videos/branded/male-barbell-landmine-row-side.mp4#t=0.1']","['Position a barbell in a landmine or corner of a room and stand facing it with your feet shoulder-width apart.', 'Grasp the end of the barbell with a neutral grip, keeping your arms straight and your shoulders relaxed.', 'Bend at the hips and knees to lower your torso until it is almost parallel to the ground.', 'Pull the barbell towards your chest, squeezing your shoulder blades together as you row the weight up.']",Barbell,Intermediate,Pull,Overhand,"{'Primary': ['Lats', 'Mid back'], 'Secondary': ['Biceps'], 'Tertiary': ['Forearms']}",,,
489,Plate Pinch Grip Row,"['https://media.musclewiki.com/media/uploads/videos/branded/male-plate-pinch-grip-row-front.mp4#t=0.1', 'https://media.musclewiki.com/media/uploads/videos/branded/male-plate-pinch-grip-row-side.mp4#t=0.1']","['Make sure to keep your elbow close to your body and your core engaged throughout the movement.', 'Bend forward at your hips while maintaining a flat back.', 'Pull the plate toward your upper abdomen.', 'Lower the weight in a controlled manner and repeat.']",Plate,Intermediate,Pull,Pinch Grip,"{'Primary': ['Forearms'], 'Secondary': ['Lats'], 'Tertiary': ['Biceps']}",,,
490,Plate Pinch Grip Deadlift,"['https://media.musclewiki.com/media/uploads/videos/branded/male-plate-pinch-grip-deadlift-front.mp4#t=0.1', 'https://media.musclewiki.com/media/uploads/videos/branded/male-plate-pinch-grip-deadlift-side.mp4#t=0.1']","['Stand facing the plate with your feet shoulder-width apart and the plate positioned between your feet.', 'Bend down and grasp the plate from the top edges with both hands, making sure your thumbs and fingers are evenly spaced.', 'Keep your back straight, chest up and core engaged, and stand up with the plate, keeping it close to your body.', 'Lower the plate back down to the ground, keeping control and maintaining good posture.']",Plate,,,Pinch Grip,"{'Primary': ['Lats', 'Forearms'], 'Secondary': ['Hamstrings', 'Glutes'], 'Tertiary': ['Lower back']}",,,
491,Pushup to Renegade Row,"['https://media.musclewiki.com/media/uploads/videos/branded/male-dumbbell-pushup-renegade-row-front.mp4#t=0.1', 'https://media.musclewiki.com/media/uploads/videos/branded/male-dumbbell-pushup-renegade-row-side.mp4#t=0.1']","['Start in a high plank position with a pair of dumbbells positioned under your shoulders. Your hands should grip the dumbbells, palms facing each other.', 'Keep your core engaged and your back straight as you row one dumbbell up towards your hip, keeping your elbow close to your body.', 'Lower the dumbbell back down to the starting position and repeat on the other side.']",Dumbbells,Intermediate,Push,Neutral,"{'Primary': ['Chest'], 'Secondary': ['Lats'], 'Tertiary': ['Abdominals']}",,,
492,TRX Ab Rollout,"['https://media.musclewiki.com/media/uploads/videos/branded/male-trx-ab-rollout-front.mp4#t=0.1', 'https://media.musclewiki.com/media/uploads/videos/branded/male-trx-ab-rollout-side.mp4#t=0.1']","['Grasp the TRX handles with both hands, keeping your arms extended and your shoulders away from your ears.', 'Keep your abs engaged, roll forward onto your toes, and extend your arms in front of you.', 'Slowly lower your body down to the ground, keeping your arms straight and your abs engaged.', 'When your head gets between your arms, pause for a moment and then use your abs to pull your body back up to the starting position.']",TRX,Advanced,Pull,Overhand,"{'Primary': ['Abdominals'], 'Secondary': ['Lats'], 'Tertiary': ['Lower back']}",,,
493,TRX Kneeling Ab Rollout,"['https://media.musclewiki.com/media/uploads/videos/branded/male-trx-kneeling-body-saw-front.mp4#t=0.1', 'https://media.musclewiki.com/media/uploads/videos/branded/male-trx-kneeling-body-saw-side.mp4#t=0.1']","['Begin in a kneeling position with the TRX straps adjusted to mid-calf length.', 'Grasp the TRX handles with both hands, keeping your arms extended and your shoulders away from your ears.', 'Keep your abs engaged, roll forward onto your toes, and extend your arms in front of you.', 'Slowly lower your body down to the ground, keeping your arms straight and your abs engaged.']",TRX,Intermediate,Pull,Overhand,"{'Primary': ['Abdominals'], 'Secondary': ['Lats']}",,,
494,Child Pose Arms Extended,"['https://media.musclewiki.com/media/uploads/videos/branded/male-yoga-balasana-child-pose-arms-extended-front.mp4#t=0.1', 'https://media.musclewiki.com/media/uploads/videos/branded/male-yoga-balasana-child-pose-arms-extended-side.mp4#t=0.1']","['Begin in a tabletop position with your hands and knees on the ground.', 'Sit back onto your heels and extend your arms out in front of you.', 'Rest your forehead on the ground.', 'Hold for a few breaths and then release.']",Yoga,Beginner,Hold,,"{'Primary': ['Lats'], 'Secondary': ['Biceps'], 'Tertiary': ['Lower back']}",,,Balasana
495,Child Pose Arms Extended Left Right,['https://media.musclewiki.com/media/uploads/videos/branded/male-yoga-balasana-child-pose-arms-extended-left-right-side.mp4#t=0.1'],"['Begin in a tabletop position with your hands and knees on the ground.', 'Sit back onto your heels and extend your arms out in front of you to one side.', 'Rest your forehead on the ground.', 'Hold for a few breaths and then repeat on the other side.']",Yoga,Beginner,Hold,,"{'Primary': ['Lats'], 'Secondary': ['Obliques']}",,,Balasana
496,Child Pose Arms On Side,"['https://media.musclewiki.com/media/uploads/videos/branded/male-yoga-balasana-child-pose-arms-on-side-front.mp4#t=0.1', 'https://media.musclewiki.com/media/uploads/videos/branded/male-yoga-balasana-child-pose-arms-on-side-side.mp4#t=0.1']","['Begin in a tabletop position with your hands and knees on the ground.', 'Sit back onto your heels and place your arms at your sides with your palms facing up.', 'Rest your forehead on the ground.', 'Hold for a few breaths and then release.']",Yoga,Beginner,Hold,,"{'Primary': ['Lats'], 'Secondary': ['Shoulders'], 'Tertiary': ['Lower back']}",,,Balasana
497,extended-side-angle-pose,"['https://media.musclewiki.com/media/uploads/videos/branded/male-yoga-extended-side-angle-rounded-spine-front.mp4#t=0.1', 'https://media.musclewiki.com/media/uploads/videos/branded/male-yoga-extended-side-angle-rounded-spine-side.mp4#t=0.1']","['Begin in a lunge position with your right foot forward and your left foot back.', 'Place your right hand on a block or the ground on the outside of your right foot.', 'Reach your left arm overhead and then round your spine, bringing your left hand to your right ear.', 'Look down towards your right foot as you reach your left arm towards the front of the room, feeling a stretch in your side body. Hold for a few breaths and then switch sides.']",Yoga,Beginner,Hold,,{'Primary': ['Lats']},,,Utthita Parsvakonasana
498,Extended side Angle Pose With Block,"['https://media.musclewiki.com/media/uploads/videos/branded/male-yoga-extended-side-angle-rounded-spine-with-block-front.mp4#t=0.1', 'https://media.musclewiki.com/media/uploads/videos/branded/male-yoga-extended-side-angle-rounded-spine-with-block-side.mp4#t=0.1']","['Begin in a lunge position with your right foot forward and your left foot back.', 'Place a block on the outside of your right foot and place your right hand on top of it.', 'Look down towards your right foot as you reach your left arm towards the front of the room, feeling a stretch in your side body. Hold for a few breaths and then switch sides.']",Yoga,Beginner,Hold,,"{'Primary': ['Lats'], 'Secondary': ['Obliques']}",,,Utthita parsvakonasana
499,Gate Pose Rounding Spine Looking Up,"['https://media.musclewiki.com/media/uploads/videos/branded/male-yoga-gate-pose-rounding-spine-looking-up-front.mp4#t=0.1', 'https://media.musclewiki.com/media/uploads/videos/branded/male-yoga-gate-pose-rounding-spine-looking-up-side.mp4#t=0.1']","['Begin in a kneeling position with your knees hip-width apart.', 'Extend your right leg out to the side, placing your foot flat on the ground.', 'Reach your right arm overhead and then round your spine, bringing your right hand to your left ear.', 'Look down towards your left foot as you reach your left arm towards your right foot, feeling a stretch in your side body. Hold for a few breaths and then switch sides.']",Yoga,Intermediate,Hold,,"{'Primary': ['Lats'], 'Secondary': ['Obliques']}",,,Parighasana
